q,a
"Николай Васильевич Шабашов (1925, Малышева, Уральская область — неизвестно) — вальщик леса Заводоуспенского леспромхоза Министерства лесной и деревообрабатывающей промышленности СССР, Тугулымский район Свердловской области, Герой Социалистического Труда (07.05.1971).","Николай Васильевич Шабашов (тысяча девятьсот двадцать пятый, Малышева, Уральская область — неизвестно) — вальщик леса Заводоуспенского леспромхоза Министерства лесной и деревообрабатывающей промышленности СССР, Тугулымский район Свердловской области, Герой Социалистического Труда (седьмого мая тысяча девятьсот семьдесят первого года)."
Звонок в службу спасения от родных поступил в 7:40.,Звонок в службу спасения от родных поступил в семь часов сорок минут.
Смещение применяемого времени относительно UTC составляет +3:00.,Смещение применяемого времени относительно UTC составляет +три часа ноль минут.
"Скончалась легендарная княгиня // Информагентство «ForUm», 22.10.2006","Скончалась легендарная княгиня // Информагентство «ForUm», двадцать второго октября две тысячи шестого года"
"Ру», 20.10.2018","Ру», двадцатого октября две тысячи восемнадцатого года"
"В сентябре Девулф снова помог бельгийской сборной вернуться в Мировую группу Кубка Дэвиса: в плей-офф бельгийцы играли с действующими обладателями Кубка — сборной Франции — и одержали победу со счётом 3:2, причём Девулф, победивший в первой же игре Фабриса Санторо, был одним из трёх бельгийских теннисистов, выигравших свои одиночные встречи (две других победы одержали Йохан ван Херк и Кристоф ван Гарссе).","В сентябре Девулф снова помог бельгийской сборной вернуться в Мировую группу Кубка Дэвиса: в плей-офф бельгийцы играли с действующими обладателями Кубка — сборной Франции — и одержали победу со счётом три:два, причём Девулф, победивший в первой же игре Фабриса Санторо, был одним из трёх бельгийских теннисистов, выигравших свои одиночные встречи (две других победы одержали Йохан ван Херк и Кристоф ван Гарссе)."
Орден Отечественной войны 1-й степени (06.04.1985);,Орден Отечественной войны первой степени (шестого апреля тысяча девятьсот восемьдесят пятого года);
Орден Славы 1-й степени (22.04.1969);,Орден Славы первой степени (двадцать второго апреля тысяча девятьсот шестьдесят девятого года);
Орден Славы 2-й степени (29.10.1944);,Орден Славы второй степени (двадцать девятого октября тысяча девятьсот сорок четвёртого года);
Орден Славы 3-й степени (15.06.1944);,Орден Славы третьей степени (пятнадцатого июня тысяча девятьсот сорок четвёртого года);
"Как для малолетних и подростков, так и для женщин рабочий день должен был начинаться не ранее 5:30 час. утра и оканчиваться не позднее 8:30 час. вечера, по субботам же и накануне праздников","Как для малолетних и подростков, так и для женщин рабочий день должен был начинаться не ранее пяти часов тридцати минут час. утра и оканчиваться не позднее восьми часов тридцати минут час. вечера, по субботам же и накануне праздников"
Смещение применяемого времени относительно UTC составляет +3:00.,Смещение применяемого времени относительно UTC составляет +три часа ноль минут.
Родилась 25.10.1923 году в деревне Белогаево Подгоренского района Воронежской области.,Родилась двадцать пятого октября тысяча девятьсот двадцать третьего года году в деревне Белогаево Подгоренского района Воронежской области.
"Награждён орденом Ленина (27.02.1945), орденом Славы 3-й степени (13.05.1944), медалью «За отвагу» (21.10.1943).","Награждён орденом Ленина (двадцать седьмого февраля тысяча девятьсот сорок пятого года), орденом Славы Третьей степени (тринадцатого мая тысяча девятьсот сорок четвёртого года), медалью «За отвагу» (двадцать первого октября тысяча девятьсот сорок третьего года)."
19:26) при описании южной границы владений колена Ашера.,девятнадцать часов двадцать шесть минут) при описании южной границы владений колена Ашера.
1:31).,один час тридцать один минута).
19:29):,девятнадцать часов двадцать девять минут):
"И вернулась граница к Раме, и до города «Крепость Цора», и вернулась граница к Хосе; и оказался выход её к морю из округа Ахзива.","И вернулась граница к Раме, и до города «Крепость Цора», и вернулась граница к Хосе; и оказался выход её к морю из округа Ахзива."
Время начала матчей указано местное (UTC+1:00).,Время начала матчей указано местное (UTC+один час ноль минут).
"26 января, 20:00","двадцать шестого января, двадцать часов ноль минут"
"27 января, 9:30","двадцать седьмое января, девять часов тридцать минут"
"27 января, 14:00","двадцать седьмое января, четырнадцать часов ноль минут"
"27 января, 14:00","двадцать седьмое января, четырнадцать часов ноль минут"
Последние два с половиной года войны и после ВОВ (с 22.10.1942 по 18.06.1945) командиром полка был Александр Васильевич Гриднев.,Последние два с половиной года войны и после ВОВ (с двадцать второго октября тысяча девятьсот сорок второго года по восемнадцатое июня тысяча девятьсот сорок пятого года) командиром полка был Александр Васильевич Гриднев.
"майор Казаринова Тамара Александровна, 09.12.1941 — 07.10.1942","майор Казаринова Тамара Александровна, девятого декабря тысяча девятьсот сорок первого года — седьмого октября тысяча девятьсот сорок второго года"
"майор, подполковник Гриднев Александр Васильевич, 27.10.1942 — 15.07.1945","майор, подполковник Гриднев Александр Васильевич, двадцать седьмого октября тысяча девятьсот сорок второго года — пятнадцатого июля тысяча девятьсот сорок пятого года"
"05.05.1990 младшему лейтенанту Литвяк Лидии Владимировне было присвоено звание Герой Советского Союза (посмертно, медаль № 11616 была передана родственникам героини).","пятого мая тысяча девятьсот девяностого года младшему лейтенанту Литвяк Лидии Владимировне было присвоено звание Герой Советского Союза (посмертно, медаль № одиннадцать тысяч шестьсот шестнадцать была передана родственникам героини)."
01.10.1993 старшему лейтенанту Будановой Екатерине Васильевне присвоено звание Герой России (посмертно).,первого октября тысяча девятьсот девяносто третьего года старшему лейтенанту Будановой Екатерине Васильевне присвоено звание Герой России (посмертно).
Герой Советского Союза (24.03.1945).,Герой Советского Союза (двадцать четвёртого марта тысяча девятьсот сорок пятого года).
Смещение применяемого времени относительно UTC составляет +2:00.,Смещение применяемого времени относительно UTC составляет +два часа ноль минут.
2 ноября он дебютировал в составе команды в матче с «Ботафого» (2:3).,Второго ноября он дебютировал в составе команды в матче с «Ботафого» (два:три).
"12 декабря он забил первые два гола за клуб, поразив ворота «Спорт Ресифи» (3:1).","Двенадцатого декабря он забил первые два гола за клуб, поразив ворота «Спорт Ресифи» (три:один)."
Смещение применяемого времени относительно UTC составляет +3:00.,Смещение применяемого времени относительно UTC составляет +три часа ноль минут.
"6:16), исцеленный апостолами хромой «вошел с ними в храм, ходя и скача, и хваля Бога» (Деян.","шесть часов шестнадцать минут), исцеленный апостолами хромой «вошел с ними в храм, ходя и скача, и хваля Бога» (Деян."
"3:8), апостол Павел призывает молиться, воздев руки (1Тим.","три:восемь), апостол Павел призывает молиться, воздев руки (одинТим."
"2:8), он же говорит, что незнающие и неверующие, войдя на собрание верующих, могут посчитать, что они беснуются (1Кор.","два:восемь), он же говорит, что незнающие и неверующие, войдя на собрание верующих, могут посчитать, что они беснуются (одинКор."
14:23);,четырнадцать часов двадцать три минуты);
"На чемпионате мира 2010 года провёл в ранге капитана все три матча All Whites против Словакии (1:1), Италии (1:1) и Парагвая (0:0).","На чемпионате мира две тысячи десятого года провёл в ранге капитана все три матча All Whites против Словакии (один:один), Италии (один:один) и Парагвая (ноль:ноль)."
"Волынь, 26.02.2011.","Волынь, двадцать шестого февраля две тысячи одиннадцатого года."
"Советская Волынь, 24.05.1984.","Советская Волынь, двадцать четвёртого мая тысяча девятьсот восемьдесят четвёртого года."
"Волынь, 22.05.2004","Волынь, двадцать второго мая две тысячи четвёртого года"
"Волынь-нова, 29.05.2004.","Волынь-нова, двадцать девятого мая две тысячи четвёртого года."
"Волынь-новая, 19.03.2011, с. 7.","Волынь-новая, девятнадцатого марта две тысячи одиннадцатого года, с. семь."
Командир 3-го полевого жандармского эскадрона (14.07.1895-04.06.1901).,Командир третьего полевого жандармского эскадрона (четырнадцатого июля тысяча восемьсот девяносто пятого года-четвёртого июня тысяча девятьсот первого года).
Командир 33-го драгунского Изюмского полка с 04.06.1901 по 01.12.1907.,Командир тридцать третьего драгунского Изюмского полка с четвёртого июня тысяча девятьсот первого года по первого декабря тысяча девятьсот седьмого года.
Командир 2-й бригады 11-й кавалерийской дивизии (01.12.1907-07.05.1910).,Командир второй бригады одиннадцатой кавалерийской дивизии (первого декабря тысяча девятьсот седьмого года-седьмого мая тысяча девятьсот десятого года).
Командир 1-й бригады той же дивизии (с 07.05.1910).,Командир первой бригады той же дивизии (с седьмого мая тысяча девятьсот десятого года).
Начальник 11-й кавалерийской дивизии (22.10.1914-03.11.1915).,Начальник одиннадцатой кавалерийской дивизии (двадцать второго октября тысяча девятьсот четырнадцатого года-третьего ноября тысяча девятьсот пятнадцатого года).
Смещение применяемого времени относительно UTC составляет +3:00.,Смещение применяемого времени относительно UTC составляет +три часа ноль минут.
"Если в первом чемпионате мира кореянки проиграли все три матча сборным Бразилии (0:3), Франции (0:1) и Нигерии (1:7), то в 2015 году кореянки вышли в 1/8 финала со второго места в группе, обыграв Испанию (2:1), сыграв вничью с Коста-Рикой (2:2) и уступив Бразилии (0:2).","Если в первом чемпионате мира кореянки проиграли все три матча сборным Бразилии (ноль:три), Франции (ноль:один) и Нигерии (один:семь), то в две тысячи пятнадцатом году кореянки вышли в один/восемь финала со второго места в группе, обыграв Испанию (два:один), сыграв вничью с Коста-Рикой (два:два) и уступив Бразилии (ноль:два)."
Смещение применяемого времени относительно UTC составляет +3:00.,Смещение применяемого времени относительно UTC составляет +три часа ноль минут.
"11 февраля, 20:00","одиннадцатого февраля, двадцать часов ноль минут"
"12 февраля, 15:00","двенадцатого февраля, пятнадцать часов ноль минут"
"13 февраля, 18:00","тринадцатого февраля, восемнадцать часов ноль минут"
"1000 метров — 1:32,00 (2 марта 1940 года, Хамар)","Тысяча метров — один час тридцать две минуты,ноль (второе марта тысяча девятьсот сорокового года, Хамар)"
"Основателем группы, её бессменным лидером, вдохновителем и главной творческой силой является Билли Гиббонс (William «Billy» Frederick Gibbons, род 16.12.1949).","Основателем группы, её бессменным лидером, вдохновителем и главной творческой силой является Билли Гиббонс (William «Billy» Frederick Gibbons, род шестнадцатого декабря тысяча девятьсот сорок девятого года)."
"11.06.1949), формально члены групп The Cellar Dwellers и American Blues.","одиннадцатого июня тысяча девятьсот сорок девятого года), формально члены групп The Cellar Dwellers и American Blues."
19.05.1949).,девятнадцатого мая тысяча девятьсот сорок девятого года).
"Хилл вспоминал: «Я перебрался в Хьюстон, даже не зная, что Фрэнк [Бирд] тоже здесь же.","Хилл вспоминал: «Я перебрался в Хьюстон, даже не зная, что Фрэнк [Бирд] тоже здесь же."
"15 сентября 1991 года в стелу была заложена капсула с посланием к потомкам, которую предполагается вскрыть 15.09.2091 года (по другим сведениям — 15.09.2041 года).","Пятнадцатого сентября тысяча девятьсот девяносто первого года в стелу была заложена капсула с посланием к потомкам, которую предполагается вскрыть пятнадцатого сентября две тысячи девяносто первого года (по другим сведениям — пятнадцатого сентября две тысячи сорок первого года)."
Смещение применяемого времени относительно UTC составляет +3:00.,Смещение применяемого времени относительно UTC составляет +три часа ноль минут.
"Установлено, что атмосфера планеты и сейчас теряет водород и кислород в соотношении 2:1.","Установлено, что атмосфера планеты и сейчас теряет водород и кислород в соотношении два к одному."
"3 июня 2023 года дебютировал в чемпионате России против «Пари Нижнего Новгорода» (0:2), выйдя на 80-й минуте встречи вместо Александра Руденко.","Третьего июня две тысячи двадцать третьего года дебютировал в чемпионате России против «Пари Нижнего Новгорода» (ноль:два), выйдя на восьмидесятой минуте встречи вместо Александра Руденко."
— 20.06.2013.,— двадцатого июня две тысячи тринадцатого года.
Орден Святой Анны 4-й ст. с надписью «За храбрость» (ВП 21.11.1905),Орден Святой Анны четвертой ст. с надписью «За храбрость» (ВП двадцать первого ноября тысяча девятьсот пятого года)
Орден Святого Станислава 3-й ст. с мечами и бантом (ВП 18.12.1905),Орден Святого Станислава третьей ст. с мечами и бантом (ВП восемнадцатого декабря тысяча девятьсот пятого года)
Орден Святого Владимира 4-й ст. (ВП 28.02.1913),Орден Святого Владимира четвертой ст. (ВП двадцать восьмого февраля тысяча девятьсот тринадцатого года)
мечи и бант к ордену Св.,мечи и бант к ордену Св.
Владимира 4-й ст. (ВП 17.12.1914),Владимира четвертой ст. (ВП семнадцатого декабря тысяча девятьсот четырнадцатого года)
"Дебютировал в составе сборной в матче кубка Ньютона с командой Уругвая в Монтевидео, где Боссио отбил пенальти от уругвайцев, а игра завершилась победой аргентинцев 1:0.","Дебютировал в составе сборной в матче кубка Ньютона с командой Уругвая в Монтевидео, где Боссио отбил пенальти от уругвайцев, а игра завершилась победой аргентинцев один:ноль."
"В первой игре турнира NCAA «Уэбфутс» обыграли «Техас Лонгхорнс» ос счётом 56:41, а затем «Оклахому Сунерс» со счётом 55:37.","В первой игре турнира NCAA «Уэбфутс» обыграли «Техас Лонгхорнс» ос счётом пятьдесят шесть:сорок один, а затем «Оклахому Сунерс» со счётом пятьдесят пять:тридцать семь."
В матче «Уэбфутс» одержали победу со счётом 46:33 и стали первыми в истории победителями турнира NCAA.,В матче «Уэбфутс» одержали победу со счётом сорок шесть:тридцать три и стали первыми в истории победителями турнира NCAA.
Дані про загиблих станом на 17:00.,Дані про загиблих станом на семнадцать часов ноль минут.
"В 1989—1992 годах выступал за «Эребру», 9 апреля 1989 года дебютировал в чемпионате Швеции в игре против «Хальмстада» (2:1).","В тысяча девятьсот восемьдесят девятом по тысяча девятьсот девяносто второй годах выступал за «Эребру», девятого апреля тысяча девятьсот восемьдесят девятого года дебютировал в чемпионате Швеции в игре против «Хальмстада» (два:один)."
младший лейтенант государственной безопасности (19.12.1936),младший лейтенант государственной безопасности (девятнадцатого декабря тысяча девятьсот тридцать шестого года)
