q,a
"25.09.1807 — 16.02.1810 — генерал-майор Миллер, Иван Иванович 3-й","двадцать пятого сентября тысяча восемьсот седьмого года — шестнадцатого февраля тысяча восемьсот десятого года — генерал-майор Миллер, Иван Иванович третьей"
"16.02.1810 — 01.09.1814 — генерал-майор (с 29.12.1811 генерал-лейтенант) Сабанеев, Иван Васильевич","шестнадцатого февраля тысяча восемьсот десятого года — первого сентября тысяча восемьсот четырнадцатого года — генерал-майор (с двадцать девятого декабря тысяча восемьсот одиннадцатого года генерал-лейтенант) Сабанеев, Иван Васильевич"
"17.05.1797 — 17.01.1799 — полковник (с 01.10.1797 полковник, с 20.08.1798 генерал-майор) Чубаров, Николай Андреевич","семнадцатого мая тысяча семьсот девяносто седьмого года — семнадцатого января тысяча семьсот девяносто девятого года — полковник (с первого октября тысяча семьсот девяносто седьмого года полковник, с двадцатого августа тысяча семьсот девяносто восьмого года генерал-майор) Чубаров, Николай Андреевич"
"20.09.1799 — 03.01.1800 — полковник Врангель, Иван Фёдорович","двадцатого сентября тысяча семьсот девяносто девятого года — третьего января тысяча восьмисотого года — полковник Врангель, Иван Фёдорович"
"22.04.1800 — 18.09.1803 — полковник (с 23.09.1800 полковник) Головачёв, Дмитрий Петрович","двадцать второго апреля тысяча восьмисотого года — восемнадцатого сентября тысяча восемьсот третьего года — полковник (с двадцать третьего сентября тысяча восьмисотого года полковник) Головачёв, Дмитрий Петрович"
"08.05.1804 — 31.07.1807 — полковник Толбухин, Павел Петрович","восьмого мая тысяча восемьсот четвёртого года — тридцать первого июля тысяча восемьсот седьмого года — полковник Толбухин, Павел Петрович"
31.07.1807 — 02.06.1812 — майор Лаптев 3-й,тридцать первого июля тысяча восемьсот седьмого года — второго июня тысяча восемьсот двенадцатого года — майор Лаптев третьей
"02.06.1812 — 25.02.1816 — подполковник (с 05.12.1813 полковник) Штегеман, Антон Осипович","второго июня тысяча восемьсот двенадцатого года — двадцать пятого февраля тысяча восемьсот шестнадцатого года — подполковник (с пятого декабря тысяча восемьсот тринадцатого года полковник) Штегеман, Антон Осипович"
"02.03.1816 — 01.01.1821 — полковник Барышников, Павел Петрович 1-й","второго марта тысяча восемьсот шестнадцатого года — первого января тысяча восемьсот двадцать первого года — полковник Барышников, Павел Петрович первой"
25.04.1821 — ? — подполковник (с 12.12.1824 полковник) Лаптев 3-й,двадцать пятого апреля тысяча восемьсот двадцать первого года — ? — подполковник (с двенадцатого декабря тысяча восемьсот двадцать четвёртого года полковник) Лаптев третьей
Время: 1:23,Время: один час двадцать три минуты
"майор Олейников Фёдор Иванович, 14.09.1941 — 22.08.1942","майор Олейников Фёдор Иванович, четырнадцатого сентября тысяча девятьсот сорок первого года — двадцать второго августа тысяча девятьсот сорок второго года"
"майор, подполковник Зайченко Сергей Данилович, 22.09.1942 — 04.1944","майор, подполковник Зайченко Сергей Данилович, двадцать второго сентября тысяча девятьсот сорок второго года — четыре.одна тысяча девятьсот сорок четыре"
"майор, подполковник Делегей Николай Куприянович, 04.1944 — 30.01.1945","майор, подполковник Делегей Николай Куприянович, четыре.одна тысяча девятьсот сорок четыре — тридцатого января тысяча девятьсот сорок пятого года"
золотая звезда «Серп и Молот» (01.08.1959),золотая звезда «Серп и Молот» (первого августа тысяча девятьсот пятьдесят девятого года)
"Два ордена Ленина (10.04.1951, 01.08.1959)","Два ордена Ленина (десятого апреля тысяча девятьсот пятьдесят первого года, первого августа тысяча девятьсот пятьдесят девятого года)"
4:5 пен.).,четыре:пять пен.).
(A1) «Out of Touch» (Extended Mix) — 6:16,(Aодин) «Out of Touch» (Extended Mix) — шесть часов шестнадцать минут
(A2) «Out of Touch» (Hardfaze Remix) — 7:55,(Aдва) «Out of Touch» (Hardfaze Remix) — семь часов пятьдесят пять минуты
(B1) «Out of Touch» (Skylab Remix) — 7:03,(Bодин) «Out of Touch» (Skylab Remix) — семь часов три минуты
(B2) «Out of Touch» (Tyrell Remix) — 6:50,(Bдва) «Out of Touch» (Tyrell Remix) — шесть часов пятьдесят минут
«Out of Touch» (Radio Mix) — 2:36,«Out of Touch» (Radio Mix) — два часа тридцать шесть минут
«Out of Touch» (Extended Mix) — 6:15,«Out of Touch» (Extended Mix) — шесть часов пятнадцать минут
«Out of Touch» (Skylab Remix) — 7:03,«Out of Touch» (Skylab Remix) — семь часов три минуты
«Out of Touch» (Tyrrell Remix) — 6:50,«Out of Touch» (Tyrrell Remix) — шесть часов пятьдесят минут
«Out of Touch» (The Vanden Plas Remix) — 7:20,«Out of Touch» (The Vanden Plas Remix) — семь часов двадцать минут
«Out of Touch» (Paul Roberts Remix) — 5:55,«Out of Touch» (Paul Roberts Remix) — пять часов пятьдесят пять минуты
Стыковка с модулем «Гармония» состоялась в 13:57 UTC.,Стыковка с модулем «Гармония» состоялась в тринадцать часов пятьдесят семь минут UTC.
В 15:45 корабль был отпущен манипулятором «Канадарм2».,В пятнадцать часов сорок пять минуты корабль был отпущен манипулятором «Канадарм два».
"В соответствии с законами Липецкой области №114-оз от 02.07.2004 и №126-оз от 23.09.2004 сельсовет наделён статусом сельского поселения, установлены границы муниципального образования.","В соответствии с законами Липецкой области № сто четырнадцать-оз от второго июля две тысячи четвёртого года и №сто двадцать шесть-оз от двадцать третьего сентября две тысячи четвёртого года сельсовет наделён статусом сельского поселения, установлены границы муниципального образования."
Голосование проводилось с 7:00 до 22:00.,Голосование проводилось с семи часов ноля минут до двадцати двух часов ноля минут.
"По сообщению Александра Черненко, пресс-секретаря комитета избирателей Украины, подавляющее большинство избирательных участков были открыты для голосования вовремя — в 7:00 утра.","По сообщению Александра Черненко, пресс-секретаря комитета избирателей Украины, подавляющее большинство избирательных участков были открыты для голосования вовремя — в семь часов ноль минут утра."
Смещение применяемого времени относительно UTC составляет +3:00.,Смещение применяемого времени относительно UTC составляет +три часа ноль минут.
"Первым начальником училища был назначен генерал-майор Железников Карп Афанасьевич (23.06.1944-27.04.1950), заместителем начальника училища по политчасти — начальником политотдела полковник Толстой Георгий Ильич (25.07.1944-03.02.1950), заместителем начальника училища — начальником учебного отдела полковник Аверин Александр Ильич.","Первым начальником училища был назначен генерал-майор Железников Карп Афанасьевич (двадцать третьего июня тысяча девятьсот сорок четвёртого года-двадцать седьмого апреля тысяча девятьсот пятидесятого года), заместителем начальника училища по политчасти — начальником политотдела полковник Толстой Георгий Ильич (двадцать пятого июля тысяча девятьсот сорок четвёртого года-третьего февраля тысяча девятьсот пятидесятого года), заместителем начальника училища — начальником учебного отдела полковник Аверин Александр Ильич."
Вручение Знамени производил заместитель начальника УВУЗ ГУК НКО СССР гвардии генерал-майор Никитченко.,Вручение Знамени производил заместитель начальника УВУЗ ГУК НКО СССР гвардии генерал-майор Никитченко.
"30.08.1956 Горьковское Суворовское военное училище передислоцировано в г. Москву (Фили) на фонды, освобожденные Центральными курсами усовершенствования офицеров разведки, и переименовано в Московское Суворовское военное училище.","тридцатого августа тысяча девятьсот пятьдесят шестого года Горьковское Суворовское военное училище передислоцировано в г. Москву (Фили) на фонды, освобожденные Центральными курсами усовершенствования офицеров разведки, и переименовано в Московское Суворовское военное училище."
"Александр Карлович (1822—31.05.1824), умер от зубной болезни, похоронен на Фарфоровском кладбище.","Александр Карлович (одна тысяча восемьсот двадцать второй—тридцать первого мая тысяча восемьсот двадцать четвёртого года), умер от зубной болезни, похоронен на Фарфоровском кладбище."
Орден Святого апостола Андрея Первозванного (22.09.1829),Орден Святого апостола Андрея Первозванного (двадцать второго сентября тысяча восемьсот двадцать девятого года)
Алмазные знаки к ордену Святого апостола Андрея Первозванного (23.04.1834),Алмазные знаки к ордену Святого апостола Андрея Первозванного (двадцать третьего апреля тысяча восемьсот тридцать четвёртого года)
Орден Святого Владимира 1-й степени (27.09.1818),Орден Святого Владимира первой степени (двадцать седьмого сентября тысяча восемьсот восемнадцатого года)
Орден Святого Владимира 2-й степени (15.09.1813),Орден Святого Владимира второй степени (пятнадцатого сентября тысяча восемьсот тринадцатого года)
Орден Святого Владимира 3-й степени (01.01.1811),Орден Святого Владимира третьей степени (первого января тысяча восемьсот одиннадцатого года)
Орден Святого Александра Невского (29.03.1814),Орден Святого Александра Невского (двадцать девятого марта тысяча восемьсот четырнадцатого года)
Алмазные знаки к ордену Святого Александра Невского (25.03.1817),Алмазные знаки к ордену Святого Александра Невского (двадцать пятого марта тысяча восемьсот семнадцатого года)
Орден Святой Анны 1-й степени (22.09.1829),Орден Святой Анны первой степени (двадцать второго сентября тысяча восемьсот двадцать девятого года)
"Орден Белого орла (Царство Польское, 14.03.1818)","Орден Белого орла (Царство Польское, четырнадцатого марта тысяча восемьсот восемнадцатого года)"
Смещение применяемого времени относительно UTC составляет +3:00.,Смещение применяемого времени относительно UTC составляет +три часа ноль минут.
"В Российской Федерации действует стандарт ГОСТ 34.12-2015 с режимами шифрования блока сообщения длиной 64 («Магма») и 128 («Кузнечик») битов, и длиной ключа 256 бит.","В Российской Федерации действует стандарт ГОСТ тридцать четыре.от двенадцати до двух тысячи пятнадцати с режимами шифрования блока сообщения длиной шестьдесят четыре («Магма») и сто двадцать восемь («Кузнечик») битов, и длиной ключа двести пятьдесят шесть бит."
"Роальд Борисович Кондра́тьев (23 октября 1929, г. Краснодар, Северо-Кавказский край, РСФСР, СССР — 23 мая 2017) — cоветский и российский учёный в области технологии возделывания зерновых культур в Сибири и на Дальнем Востоке, академик ВАСХНИЛ (14.06.1988), академик РАН (30.09.2013).","Роальд Борисович Кондра́тьев (двадцать три октября одна тысяча девятьсот двадцать девять, г. Краснодар, Северо-Кавказский край, РСФСР, СССР — двадцать три мая две тысячи семнадцать) — cоветский и российский учёный в области технологии возделывания зерновых культур в Сибири и на Дальнем Востоке, академик ВАСХНИЛ (четырнадцатого июня тысяча девятьсот восемьдесят восьмого года), академик РАН (тридцатого сентября две тысячи тринадцатого года)."
Смещение применяемого времени относительно UTC составляет +3:00.,Смещение применяемого времени относительно UTC составляет +три часа ноль минут.
полковник (29.11.1935);,полковник (двадцать девятого ноября тысяча девятьсот тридцать пятого года);
генерал-майор танковых войск (Постановление СНК СССР № 187 от 18.02.1944);,генерал-майор танковых войск (Постановление СНК СССР № сто восемьдесят семь от восемнадцатого февраля тысяча девятьсот сорок четвёртого года);
генерал-лейтенант танковых войск (Постановление СНК СССР № 1511 от 27.06.1945).,генерал-лейтенант танковых войск (Постановление СНК СССР № одна тысяча пятьсот одиннадцать от двадцать седьмого июня тысяча девятьсот сорок пятого года).
два ордена Ленина (в том числе 21.02.1945),два ордена Ленина (в том числе двадцать первого февраля тысяча девятьсот сорок пятого года)
"три ордена Красного Знамени (25.08.1943, 03.11.1944, 24.06.1948)","три ордена Красного Знамени (двадцать пятого августа тысяча девятьсот сорок третьего года, третьего ноября тысяча девятьсот сорок четвёртого года, двадцать четвёртого июня тысяча девятьсот сорок восьмого года)"
орден Суворова I степени (06.04.1945),орден Суворова первой степени (шестого апреля тысяча девятьсот сорок пятого года)
орден Суворова II степени (10.01.1944),орден Суворова второй степени (десятого января тысяча девятьсот сорок четвёртого года)
орден Кутузова II степени (11.08.1944),орден Кутузова второй степени (одиннадцатого августа тысяча девятьсот сорок четвёртого года)
(22.06.1945),(двадцать второго июня тысяча девятьсот сорок пятого года)
Отношение ширины флага к его длине составляет 2:3.,Отношение ширины флага к его длине составляет два:три.
орден Трудового Красного Знамени (10.06.1945),орден Трудового Красного Знамени (десятого июня тысяча девятьсот сорок пятого года)
"«Флаг города Дудинки представляет собой прямоугольное полотнище с соотношением сторон 2:3, несущее в центре изображение фигур герба города, фигуры и деление смещены к древку».","«Флаг города Дудинки представляет собой прямоугольное полотнище с соотношением сторон два:три, несущее в центре изображение фигур герба города, фигуры и деление смещены к древку»."
"21.08.1960, г.Нижний Тагил, Свердловская область).","двадцать первого августа тысяча девятьсот шестидесятого года, г.Нижний Тагил, Свердловская область)."
Названия института в разные годы (по состоянию на 01.11.2010):,Названия института в разные годы (по состоянию на первого ноября две тысячи десятого года):
Руководители института в разные годы (по состоянию на 01.11.2010):,Руководители института в разные годы (по состоянию на первого ноября две тысячи десятого года):
Собственниками компании являются (по состоянию на 01.09.2010):,Собственниками компании являются (по состоянию на первого сентября две тысячи десятого года):
Свой первый матч в стартовом составе Ареола провёл уже в следующие выходные: «Лорьян» не смог составить конкуренцию «Пари Сен-Жермен» и проиграл со счетом 1:3.,Свой первый матч в стартовом составе Ареола провёл уже в следующие выходные: «Лорьян» не смог составить конкуренцию «Пари Сен-Жермен» и проиграл со счетом один:три.
Дебют  в составе нового клуба произошёл уже в день открытия сезона: матч против «Реал Бетис» закончился со счётом 1:1.,Дебют  в составе нового клуба произошёл уже в день открытия сезона: матч против «Реал Бетис» закончился со счётом один:один.
Матч Лиги чемпионов против лондонского «Арсенала» завершился со счетом 1:1.,Матч Лиги чемпионов против лондонского «Арсенала» завершился со счетом один:один.
"В апреле 2017 года Ареола провёл на скамейке запасных финальный матч Кубка французской лиги против «Монако» (4:1), по итогам которого парижский клуб выиграл свой четвёртый подряд Кубок.","В апреле две тысячи семнадцатого года Ареола провёл на скамейке запасных финальный матч Кубка французской лиги против «Монако» (четыре:один), по итогам которого парижский клуб выиграл свой четвёртый подряд Кубок."
