q,a
"Александр Карлович (1822—31.05.1824), умер от зубной болезни, похоронен на Фарфоровском кладбище.","Александр Карлович (одна тысяча восемьсот двадцать второй—тридцать первого мая тысяча восемьсот двадцать четвёртого года), умер от зубной болезни, похоронен на Фарфоровском кладбище."
Орден Святого апостола Андрея Первозванного (22.09.1829),Орден Святого апостола Андрея Первозванного (двадцать второго сентября тысяча восемьсот двадцать девятого года)
Алмазные знаки к ордену Святого апостола Андрея Первозванного (23.04.1834),Алмазные знаки к ордену Святого апостола Андрея Первозванного (двадцать третьего апреля тысяча восемьсот тридцать четвёртого года)
Орден Святого Владимира 1-й степени (27.09.1818),Орден Святого Владимира первой степени (двадцать седьмого сентября тысяча восемьсот восемнадцатого года)
Орден Святого Владимира 2-й степени (15.09.1813),Орден Святого Владимира второй степени (пятнадцатого сентября тысяча восемьсот тринадцатого года)
Орден Святого Владимира 3-й степени (01.01.1811),Орден Святого Владимира третьей степени (первого января тысяча восемьсот одиннадцатого года)
Орден Святого Александра Невского (29.03.1814),Орден Святого Александра Невского (двадцать девятого марта тысяча восемьсот четырнадцатого года)
Алмазные знаки к ордену Святого Александра Невского (25.03.1817),Алмазные знаки к ордену Святого Александра Невского (двадцать пятого марта тысяча восемьсот семнадцатого года)
Орден Святой Анны 1-й степени (22.09.1829),Орден Святой Анны первой степени (двадцать второго сентября тысяча восемьсот двадцать девятого года)
"Орден Белого орла (Царство Польское, 14.03.1818)","Орден Белого орла (Царство Польское, четырнадцатого марта тысяча восемьсот восемнадцатого года)"
Смещение применяемого времени относительно UTC составляет +3:00.,Смещение применяемого времени относительно UTC составляет +три часа ноль минут.
"В Российской Федерации действует стандарт ГОСТ 34.12-2015 с режимами шифрования блока сообщения длиной 64 («Магма») и 128 («Кузнечик») битов, и длиной ключа 256 бит.","В Российской Федерации действует стандарт ГОСТ тридцать четыре.от двенадцати до двух тысячи пятнадцати с режимами шифрования блока сообщения длиной шестьдесят четыре («Магма») и сто двадцать восемь («Кузнечик») битов, и длиной ключа двести пятьдесят шесть бит."
"Роальд Борисович Кондра́тьев (23 октября 1929, г. Краснодар, Северо-Кавказский край, РСФСР, СССР — 23 мая 2017) — cоветский и российский учёный в области технологии возделывания зерновых культур в Сибири и на Дальнем Востоке, академик ВАСХНИЛ (14.06.1988), академик РАН (30.09.2013).","Роальд Борисович Кондра́тьев (двадцать три октября одна тысяча девятьсот двадцать девять, г. Краснодар, Северо-Кавказский край, РСФСР, СССР — двадцать три мая две тысячи семнадцать) — cоветский и российский учёный в области технологии возделывания зерновых культур в Сибири и на Дальнем Востоке, академик ВАСХНИЛ (четырнадцатого июня тысяча девятьсот восемьдесят восьмого года), академик РАН (тридцатого сентября две тысячи тринадцатого года)."
Смещение применяемого времени относительно UTC составляет +3:00.,Смещение применяемого времени относительно UTC составляет +три часа ноль минут.
полковник (29.11.1935);,полковник (двадцать девятого ноября тысяча девятьсот тридцать пятого года);
генерал-майор танковых войск (Постановление СНК СССР № 187 от 18.02.1944);,генерал-майор танковых войск (Постановление СНК СССР № сто восемьдесят семь от восемнадцатого февраля тысяча девятьсот сорок четвёртого года);
генерал-лейтенант танковых войск (Постановление СНК СССР № 1511 от 27.06.1945).,генерал-лейтенант танковых войск (Постановление СНК СССР № одна тысяча пятьсот одиннадцать от двадцать седьмого июня тысяча девятьсот сорок пятого года).
два ордена Ленина (в том числе 21.02.1945),два ордена Ленина (в том числе двадцать первого февраля тысяча девятьсот сорок пятого года)
"три ордена Красного Знамени (25.08.1943, 03.11.1944, 24.06.1948)","три ордена Красного Знамени (двадцать пятого августа тысяча девятьсот сорок третьего года, третьего ноября тысяча девятьсот сорок четвёртого года, двадцать четвёртого июня тысяча девятьсот сорок восьмого года)"
орден Суворова I степени (06.04.1945),орден Суворова первой степени (шестого апреля тысяча девятьсот сорок пятого года)
орден Суворова II степени (10.01.1944),орден Суворова второй степени (десятого января тысяча девятьсот сорок четвёртого года)
орден Кутузова II степени (11.08.1944),орден Кутузова второй степени (одиннадцатого августа тысяча девятьсот сорок четвёртого года)
(22.06.1945),(двадцать второго июня тысяча девятьсот сорок пятого года)
Отношение ширины флага к его длине составляет 2:3.,Отношение ширины флага к его длине составляет два:три.
орден Трудового Красного Знамени (10.06.1945),орден Трудового Красного Знамени (десятого июня тысяча девятьсот сорок пятого года)
"«Флаг города Дудинки представляет собой прямоугольное полотнище с соотношением сторон 2:3, несущее в центре изображение фигур герба города, фигуры и деление смещены к древку».","«Флаг города Дудинки представляет собой прямоугольное полотнище с соотношением сторон два:три, несущее в центре изображение фигур герба города, фигуры и деление смещены к древку»."
"21.08.1960, г.Нижний Тагил, Свердловская область).","двадцать первого августа тысяча девятьсот шестидесятого года, г.Нижний Тагил, Свердловская область)."
Названия института в разные годы (по состоянию на 01.11.2010):,Названия института в разные годы (по состоянию на первого ноября две тысячи десятого года):
Руководители института в разные годы (по состоянию на 01.11.2010):,Руководители института в разные годы (по состоянию на первого ноября две тысячи десятого года):
Собственниками компании являются (по состоянию на 01.09.2010):,Собственниками компании являются (по состоянию на первого сентября две тысячи десятого года):
Свой первый матч в стартовом составе Ареола провёл уже в следующие выходные: «Лорьян» не смог составить конкуренцию «Пари Сен-Жермен» и проиграл со счетом 1:3.,Свой первый матч в стартовом составе Ареола провёл уже в следующие выходные: «Лорьян» не смог составить конкуренцию «Пари Сен-Жермен» и проиграл со счетом один:три.
Дебют  в составе нового клуба произошёл уже в день открытия сезона: матч против «Реал Бетис» закончился со счётом 1:1.,Дебют  в составе нового клуба произошёл уже в день открытия сезона: матч против «Реал Бетис» закончился со счётом один:один.
Матч Лиги чемпионов против лондонского «Арсенала» завершился со счетом 1:1.,Матч Лиги чемпионов против лондонского «Арсенала» завершился со счетом один:один.
"В апреле 2017 года Ареола провёл на скамейке запасных финальный матч Кубка французской лиги против «Монако» (4:1), по итогам которого парижский клуб выиграл свой четвёртый подряд Кубок.","В апреле две тысячи семнадцатого года Ареола провёл на скамейке запасных финальный матч Кубка французской лиги против «Монако» (четыре:один), по итогам которого парижский клуб выиграл свой четвёртый подряд Кубок."
"Однако финальный матч Кубка Франции против «Анже» Ареола начал в стартовом составе, позволив «Пари Сен-Жермен» одержать победу со счётом 1:0.","Однако финальный матч Кубка Франции против «Анже» Ареола начал в стартовом составе, позволив «Пари Сен-Жермен» одержать победу со счётом один:ноль."
"29 июля 2017 года Ареола получил свою вторую медаль Суперкубка Франции, когда «парижане» обыграли «Монако» со счетом 2:1.","двадцать девятого июля две тысячи семнадцатого года Ареола получил свою вторую медаль Суперкубка Франции, когда «парижане» обыграли «Монако» со счетом два:один."
25 сентября дебютировал в составе нового клуба: «Реал» одержал победу над «Осасуной» со счётом 2:0.,двадцать пятого сентября дебютировал в составе нового клуба: «Реал» одержал победу над «Осасуной» со счётом два:ноль.
Штабс-капитан — 24.03.1916,Штабс-капитан — двадцать четвёртого марта тысяча девятьсот шестнадцатого года
Капитан — 07.11.1916,Капитан — седьмого ноября тысяча девятьсот шестнадцатого года
Комбриг — 04.12.1935,Комбриг — четвёртого декабря тысяча девятьсот тридцать пятого года
Комдив — 26.04.1940,Комдив — двадцать шестого апреля тысяча девятьсот сорокового года
Генерал-майор — 04.06.1940,Генерал-майор — четвёртого июня тысяча девятьсот сорокового года
Орден Святого Станислава II степени с мечами (07.11.1916),Орден Святого Станислава второй степени с мечами (седьмого ноября тысяча девятьсот шестнадцатого года)
"Орден Святой Анны IV степени с надписью ""За храбрость"" (03.11.1916)","Орден Святой Анны четвертой степени с надписью ""За храбрость"" (третьего ноября тысяча девятьсот шестнадцатого года)"
Орден Святого Станислава III степени с мечами и бантом (09.11.1915),Орден Святого Станислава третьей степени с мечами и бантом (девятого ноября тысяча девятьсот пятнадцатого года)
Орден Ленина № 33701 (21.02.1945),Орден Ленина № тридцать три тысячи семьсот один (двадцать первого февраля тысяча девятьсот сорок пятого года)
"Два ордена Красного Знамени (23.02.1928, 22.02.1930)","Два ордена Красного Знамени (двадцать третьего февраля тысяча девятьсот двадцать восьмого года, двадцать второго февраля тысяча девятьсот тридцатого года)"
Орден Кутузова II степени №1056 (21.06.1944),Орден Кутузова второй степени № одна тысяча пятьдесят шесть (двадцать первого июня тысяча девятьсот сорок четвёртого года)
Орден Отечественной войны I степени (25.02.1944),Орден Отечественной войны первой степени (двадцать пятого февраля тысяча девятьсот сорок четвёртого года)
Медаль «За оборону Москвы» (04.04.1945),Медаль «За оборону Москвы» (четвёртого апреля тысяча девятьсот сорок пятого года)
Юбилейная медаль «XX лет Рабоче-Крестьянской Красной Армии» (22.02.1938),Юбилейная медаль «XX лет Рабоче-Крестьянской Красной Армии» (двадцать второго февраля тысяча девятьсот тридцать восьмого года)
"[5]  (недоступная ссылка с 05-09-2013 [3884 дня] — история, копия) (итал.)","[пять]  (недоступная ссылка с от пяти до девяти-две тысячи тринадцать [три тысячи восемьсот восемьдесят четыре дня] — история, копия) (итал.)"
"Закон о единой графической основе — федеральный закон от 11.12.2002 № 165-ФЗ «О внесении дополнения в статью 3 Закона Российской Федерации „О языках народов Российской Федерации“», которым единственной возможной письменностью всех государственных языков Российской Федерации утверждалась кириллица.","Закон о единой графической основе — федеральный закон от одиннадцатого декабря две тысячи второго года № сто шестьдесят пять-ФЗ «О внесении дополнения в статью три Закона Российской Федерации „О языках народов Российской Федерации“», которым единственной возможной письменностью всех государственных языков Российской Федерации утверждалась кириллица."
"Депутаты Госдумы из Татарстана Фандас Сафиуллин и Наиль Хуснутдинов назвали новый закон попыткой «создать проблему на пустом месте» и обратились в Конституционный суд России, который своим постановлением № 16-П от 16.11.2004 подтвердил право федеральных властей устанавливать графическую основу языков России.","Депутаты Госдумы из Татарстана Фандас Сафиуллин и Наиль Хуснутдинов назвали новый закон попыткой «создать проблему на пустом месте» и обратились в Конституционный суд России, который своим постановлением № шестнадцать-П от шестнадцатого ноября две тысячи четвёртого года подтвердил право федеральных властей устанавливать графическую основу языков России."
"Рустемов Е. Д. УДК 81""1:81""246.","Рустемов Е. Д. УДК восемьдесят один""один:восемьдесят один""двести сорок шесть."
3,три
Смещение применяемого времени относительно UTC составляет +4:00.,Смещение применяемого времени относительно UTC составляет +четыре часа ноль минут.
В соответствии с применяемым временем и географической долготой средний солнечный полдень в Самаре наступает в 12:39.,В соответствии с применяемым временем и географической долготой средний солнечный полдень в Самаре наступает в двенадцать часов тридцать девять минут.
Отношение ширины к длине флага составляет 1:2.,Отношение ширины к длине флага составляет один:два.
Соотношение высоты и ширины герба к ширине и длине Флага составляет соответственно 1:2 и 1:7.,Соотношение высоты и ширины герба к ширине и длине Флага составляет соответственно один:два и один:семь.
Расстояние от верхней кромки флага до герба составляет 1:7 ширины флага.,Расстояние от верхней кромки флага до герба составляет один:семь ширины флага.
Расстояние от нижней кромки Флага до основания надписи относится к ширине флага как 1:7.,Расстояние от нижней кромки Флага до основания надписи относится к ширине флага как один:семь.
Высота строчных букв составляет 1:10 ширины флага.,Высота строчных букв составляет один час десять минут ширины флага.
орден Ленина (11.09.1956);,орден Ленина (одиннадцатого сентября тысяча девятьсот пятьдесят шестого года);
"трижды орден Красного Знамени (10.04.1945, 30.01.1951);","трижды орден Красного Знамени (десятого апреля тысяча девятьсот сорок пятого года, тридцатого января тысяча девятьсот пятьдесят первого года);"
"дважды орден Трудового Красного Знамени (23.01.1948, 05.11.1954);","дважды орден Трудового Красного Знамени (двадцать третьего января тысяча девятьсот сорок восьмого года, пятого ноября тысяча девятьсот пятьдесят четвёртого года);"
"дважды орден Красной Звезды (02.11.1944, 10.12.1945);","дважды орден Красной Звезды (второго ноября тысяча девятьсот сорок четвёртого года, десятого декабря тысяча девятьсот сорок пятого года);"
орден «Знак Почёта» (26.04.1940);,орден «Знак Почёта» (двадцать шестого апреля тысяча девятьсот сорокового года);
знак «Заслуженный работник НКВД» (18.02.1946).,знак «Заслуженный работник НКВД» (восемнадцатого февраля тысяча девятьсот сорок шестого года).
Смещение применяемого времени относительно UTC составляет +3:00.,Смещение применяемого времени относительно UTC составляет +три часа ноль минут.
Смещение применяемого времени относительно UTC составляет +4:00.,Смещение применяемого времени относительно UTC составляет +четыре часа ноль минут.
"Олег Радзинский: «Особо опасный филолог» Радио Свобода, 17.05.2022","Олег Радзинский: «Особо опасный филолог» Радио Свобода, семнадцатого мая две тысячи двадцать второго года"
"Брат — Генри (14.11.1871 — 11.10.1937) — импресарио, дирижёр, вокальный педагог.","Брат — Генри (четырнадцатого ноября тысяча восемьсот семьдесят первого года — одиннадцатого октября тысяча девятьсот тридцать седьмого года) — импресарио, дирижёр, вокальный педагог."
05.12.1996).,пятого декабря тысяча девятьсот девяносто шестого года).
