q,a
"""Двунаправленное разделение мод и повторное объединение для преобразования мод в плоских волноводах"" (https://doi.org/10.1109%2FACCESS.2018.2873278 ).","""Двунаправленное разделение мод и повторное объединение для преобразования мод в плоских волноводах"" (https://doi.org/10.1109%2FACCESS,2018. двести семьдесят три целых двести семьдесят восемь тысячных )."
Код нагрудника:2022NatCo..13..103 часа (https://ui.adsabs.harva+rd.edu/abs/2022NatCo..13..103H ). doi:10.1038/s41467-021-27662-1 (https://doi.org/10.103 8%2Fs41467-021-27662-1 ).,Код нагрудника:2022NatCo..тринадцать целых одна сотая часа (https://ui.adsabs.harva+rd.edu/abs/2022NatCo..тринадцать целых сто тридцать две тысячных/s41467-021-27662-1 (https://doi.org/10.10.1038/s41467-021-27662-1 ).
Bibcode:1988ApOpt..27.1687B (https://ui.adsabs.harvard.edu/+abs/1988ApOpt..27.1687B). doi:10.1364/AO.27.001687 (https://doi.org/10.1364%2FAO.27.0 01687).,Bibcode:1988ApOpt.. двадцать семь целых сто восемьдесят семь тысячныхB (https://ui.adsabs.harvard.edu/+abs/1988ApOpt.. двадцать семь целых двести восемьдесят семь тысячныхFAO. двадцать семь целых ноль тысячныхFAO. двадцать семь целых ноль тысячныхFAO. двадцать семь целых ноль тысячных).
"Площадь сада составляет 5,7 га.",Площадь сада составляет пять целых семь десятых га.
"Мероприятия, на которые было выделено 131,72 млн рублей, включали в себя ремонт ограды, мостов и дорожек, укрепление берегов водоемов, посадку деревьев и кустов.","Мероприятия, на которые было выделено сто тридцать одна целая семьдесят две сотых млн рублей, включали в себя ремонт ограды, мостов и дорожек, укрепление берегов водоемов, посадку деревьев и кустов."
"Внедрение централизованных перевозок решило вопрос обеспечения АЗС нефтепродуктами минимальным количеством транспорта, производительность труда увеличилось на 14,7 %.","Внедрение централизованных перевозок решило вопрос обеспечения АЗС нефтепродуктами минимальным количеством транспорта, производительность труда увеличилось на четырнадцать целых семь десятых %."
"На 3,3 тысячи тонн больше запланированного перевезла нефтепродуктов, сэкономила значительное количество топлива.","На три целых три десятых тысячи тонн больше запланированного перевезла нефтепродуктов, сэкономила значительное количество топлива."
"Уровень грамотности 85,24 %, в том числе среди мужчин 89,2 % и среди женщин — 80,1 %.","Уровень грамотности восемьдесят пять целых двадцать четыре сотых %, в том числе среди мужчин восемьдесят девять целых две десятых % и среди женщин — восемьдесят целых одна десятая %."
"В настоящее время российский сегмент международной космической станции может напрямую взаимодействовать с ЦУПами в течение около 2,5 часов в сутки.",В настоящее время российский сегмент международной космической станции может напрямую взаимодействовать с ЦУПами в течение около двух с половиной часов в сутки.
"По данным Бюро переписи населения США площадь тауншипа составляет 93,0 км², из которых 92,2 км² занимает суша, а 0,8 км² — вода (0,89 %).","По данным Бюро переписи населения США площадь тауншипа составляет девяносто три целых ноль десятых км2, из которых девяносто две целых две десятых км2 занимает суша, а ноль целых восемь десятых км2 — вода (ноль целых восемь десятых9 %)."
"Плотность населения —  7,5 чел./км².",Плотность населения — семь с половиной чел./км2.
"Расовый состав населения: 98,12 % белых, 0,29 % азиатов, 0,58 % — других рас США и 1,01 % приходится на две или более других рас.","Расовый состав населения: девяносто восемь целых двенадцать сотых % белых, ноль целых двадцать девять сотых % азиатов, ноль целых пятьсот пятьдесят восемь тысячных % — других рас США и одна целая одна сотая % приходится на две или более других рас."
"Испанцы или латиноамериканцы любой расы составляли 1,59 % от популяции тауншипа.",Испанцы или латиноамериканцы любой расы составляли одна целая пятьдесят девять сотых % от популяции тауншипа.
"Средний размер домохозяйства — 3,04, а семьи — 3,37 человека.","Средний размер домохозяйства — три целых четыре сотых, а семьи — три целых тридцать семь сотых человека."
"электрификация: 97,2 %;",электрификация: девяносто семь целых две десятых %;
"водоснабжение: 98,6 %;",водоснабжение: девяносто восемь целых шесть десятых %;
"водоотведение: 83,7 %.",водоотведение: восемьдесят три целых семь десятых %.
"Занимает площадь 16,85 км².",Занимает площадь шестнадцать целых восемьдесят пять сотых км2.
"Средняя температура воздуха самого холодного месяца (января) — −11,3 °C; самого тёплого месяца (июля) — 20,4 °C. Безморозный период длится 142—147 дней.",Средняя температура воздуха самого холодного месяца (января) — минус одиннадцать целых три десятых C; самого тёплого месяца (июля) — двадцать целых четыре десятых C. Безморозный период длится сто тридцать две целых сто семьдесят семь тысячных дней.
"Среднегодовая температура воздуха — 2,1 °C. Средняя температура воздуха самого холодного месяца (января) — −12,3 °C (абсолютный минимум — −50 °C), средняя температура самого тёплого (июля) — 16,5 °С (абсолютный максимум — 35 °C).","Среднегодовая температура воздуха — две целых одна десятая C. Средняя температура воздуха самого холодного месяца (января) — минус двенадцать с половиной C (абсолютный минимум — 50 C), средняя температура самого тёплого (июля) — шестнадцать с половиной С (абсолютный максимум — тридцать пять с половиной C)."
"Среднегодовая температура воздуха — 2,5 °C. Средняя температура воздуха самого холодного месяца (января) — −12,6 °C (абсолютный минимум — −38 °C); самого тёплого месяца (июля) — 18,2 °C (абсолютный максимум — 36 °С).",Среднегодовая температура воздуха — два с половиной C. Средняя температура воздуха самого холодного месяца (января) — минус двенадцать целых шесть десятых C (абсолютный минимум — 38 C); самого тёплого месяца (июля) — восемнадцать целых две десятых C (абсолютный максимум — тридцать шесть десятых С (абсолютный максимум — тридцать шесть десятых С).
"Среднегодовая температура положительная и составляет +1,2 °С, средняя температура самого холодного месяца января −17,6 °C, самого жаркого месяца июля +19,4 °С. Многолетняя норма осадков — 381 мм, наибольшее количество осадков выпадает в июле — 65 мм, наименьшее в марте — 13 мм","Среднегодовая температура положительная и составляет плюс одну целую две десятых С, средняя температура самого холодного месяца января минус семнадцать целых шесть десятых C, самого жаркого месяца июля плюс девятнадцать целых четыре десятых С. Многолетняя норма осадков — триста восемьдесят одна целая две десятых мм, наибольшее количество осадков выпадает в июле — шестьдесят пять целых пятьдесят две десятых мм, наименьшее в марте — тринадцать с половиной мм."
"Занимает площадь 8,67 км².",Занимает площадь восемь целых шестьдесят семь сотых км2.
"Новая модель БА-10М получила бензобаки новой конструкции ёмкостью 54,5 литра каждый, установленные снаружи корпуса на крыльях задних колес в бронированных кожухах, в отличие от прежних, которые крепились к крыше корпуса за местами водителя и пулемётчика.","Новая модель БА-10М получила бензобаки новой конструкции ёмкостью пятьдесят четыре с половиной литра каждый, установленные снаружи корпуса на крыльях задних колес в бронированных кожухах, в отличие от прежних, которые крепились к крыше корпуса за местами водителя и пулемётчика."
"При этом масса машины возросла до 5,5 тонн, но динамические качества практически не изменились.","При этом масса машины возросла до пяти с половиной тонн, но динамические качества практически не изменились."
"Занимает площадь 21,17 км².",Занимает площадь двадцать одна целая семнадцать сотых км2.
"Занимает площадь 201,471 км².",Занимает площадь двести одна целая четыреста семьдесят одна тысячная км2.
"Плотность населения — 77,2 чел./км².",Плотность населения — семьдесят семь целых две десятых чел./км2.
"Площадь 457,248 квадратного километра.",Площадь четыреста пятьдесят семь целых двести сорок восемь тысячных квадратного километра.
"Плотность 94,4 человека на квадратный километр.",Плотность девяносто четыре целых четыре десятых человека на квадратный километр.
"В низовьях скорость течения воды равна 0,1 м/с. Устье реки находится в 35 км по правому берегу Вертного.","В низовьях скорость течения воды равна ноль целых одна десятая м/с, Устье реки находится в тридцати пяти с половиной км по правому берегу Вертного."
"Сюжет второй демоверсии частично основан на главе «Коммуникационный центр» из раннего билда Half-Life (v0.52), события которой примерно соответствуют релизной главе «Ядро Лямбды».","Сюжет второй демоверсии частично основан на главе «Коммуникационный центр» из раннего билда Half-Life (v0.52), события которой примерно соответствуют релизной главе «Ядро Лямбды»."
"При этом  результаты российских юниорок (сумма баллов в команде) превысила результаты взрослых соотечественниц на 4,200 балла.",При этом результаты российских юниорок (сумма баллов в команде) превысила результаты взрослых соотечественниц на четыре целых двести пятьдесят сотых балла.
"Анна, Татьяна Набиева, Алия Мустафина, Рамиля Мусина и Ксения Афанасьева обыграли ближайших соперниц — гимнасток Японии — на четыре балла (173,850 и 169,850 соответственно).","Анна, Татьяна Набиева, Алия Мустафина, Рамиля Мусина и Ксения Афанасьева обыграли ближайших соперниц — гимнасток Японии — на четыре балла (сто девяносто три целых восемьсот пятьдесят и сто шестьдесят девять целых восемьсот пятьдесят тысячных соответственно)."
"Высота истока — 1645,2 м над уровнем моря (высота уреза воды озера Хубсугул).",Высота истока — одна тысяча шестьсот сорок пять целых две десятых м над уровнем моря (высота уреза воды озера Хубсугул).
"Среднегодовая температура — 1,6 °C. Средняя температура воздуха самого холодного месяца (января) составляет −14,4 °C (абсолютный минимум — −50 °С); самого тёплого месяца (июля) — 17,9 °C. Безморозный период длится в течение 99—123 дней.",Среднегодовая температура — одна целая шесть десятых C. Средняя температура воздуха самого холодного месяца (января) составляет минус четырнадцать целых четыре десятых C (абсолютный минимум — 50 С); самого тёплого месяца (июля) — семнадцать целых девять десятых C. Безморозный период длится в течение девяносто девять целых сто тридцать три сотых дней.
"Занимает площадь 150,12 км².",Занимает площадь сто пятьдесят целых двенадцать сотых км2.
"Занимает площадь 0,442 км².",Занимает площадь ноль целых четыреста сорок две тысячных км2.
"69,47 Радио России/ГТРК Алтай",шестьдесят девять целых сорок семь сотых Радио России/ГТРК Алтай
"104,8 Радио России/ГТРК Алтай",сто четыре целых восемь десятых Радио России/ГТРК Алтай
"По оценке редакции «Рейтинга Букмекеров», КХЛ будет получать от спонсора 1,3-1,5 млрд рублей за сезон.","По оценке редакции «Рейтинга Букмекеров», КХЛ будет получать от спонсора одна целая три десятых-одна с половиной млрд рублей за сезон."
"        21,176",двадцать одна целая сто семьдесят шесть тысячных
"        0,367",ноль целых триста шестьдесят семь тысячных
"При этом построении получается относительная ошибка в 0,83%.",При этом построении получается относительная ошибка в ноль целых восемьдесят три сотых%.
"Единственной лояльной царю силой оказались полицейские, которых в Петрограде насчитывалось всего около 3,5 тыс.","Единственной лояльной царю силой оказались полицейские, которых в Петрограде насчитывалось всего около трех с половиной тыс."
"В следующем году она завоевала бронзовую медаль на дистанции 7,5 км классическим стилем на Европейском зимнем молодежном олимпийском фестивале.",В следующем году она завоевала бронзовую медаль на дистанции семь с половиной км классическим стилем на Европейском зимнем молодежном олимпийском фестивале.
"Расстояние по автодороге до районного центра Шексны — 32,5 км, до центра муниципального образования Нестерово — 2,5 км.","Расстояние по автодороге до районного центра Шексны — тридцать два с половиной км, до центра муниципального образования Нестерово — два с половиной км."
"Занимает площадь 10,20 км².",Занимает площадь десять целых двадцать сотых км2.
"Среднегодовая температура воздуха — 2,5 °C. Средняя температура воздуха самого холодного месяца (января) — −12,6 °C (абсолютный минимум — −38 °C); самого тёплого месяца (июля) — 18,2 °C (абсолютный максимум — 36 °С).",Среднегодовая температура воздуха — два с половиной C. Средняя температура воздуха самого холодного месяца (января) — минус двенадцать целых шесть десятых C (абсолютный минимум — 38 C); самого тёплого месяца (июля) — восемнадцать целых две десятых C (абсолютный максимум — тридцать шесть десятых С (абсолютный максимум — тридцать шесть десятых С).
"Телефон оснащен дисплеем Super AMOLED Plus FHD + 6,7 дюйма.",Телефон оснащен дисплеем Super AMOLED Plus FHD плюс шесть целых семь десятых дюйма.
"Вглубь материка или острова не залетает, гнёзда устраивает на расстоянии не более 0,5 км от воды.","Вглубь материка или острова не залетает, гнёзда устраивает на расстоянии не более ноль с половиной км от воды."
"Протяжённость улицы составляет около 1,2 км.",Протяжённость улицы составляет около одной целой двух десятых км.
"Ближайшие к улице Катерников остановочные пункты железной дороги, Сосновая Поляна и Лигово, находятся на расстояниях около 2,6 км и 3,1 км по прямой от конца улицы соответственно.","Ближайшие к улице Катерников остановочные пункты железной дороги, Сосновая Поляна и Лигово, находятся на расстояниях около двух целых шести десятых км и трех целых одой десятой км по прямой от конца улицы соответственно."
"Около 3,5 тыс. человек (большинство из них женщины) умерли в результате операции.",Около трех с половиной тыс. человек (большинство из них женщины) умерли в результате операции.
"Утулик находится в водоохранной зоне озера Байкал, поэтому там запрещены экологически опасные производства, поэтому экологическое состояние Утулика можно оценить как благоприятное. в связи с этим Утулик становится популярным у туристов, и для защиты нетронутой природной среды от чрезмерного негативного нерегулируемого антропогенного влияния было запланировано создание природного парка «Утулик-Бабха» в качестве ООПТ регионального уровня общей площадью 7,2 га.","Утулик находится в водоохранной зоне озера Байкал, поэтому там запрещены экологически опасные производства, поэтому экологическое состояние Утулика можно оценить как благоприятное. в связи с этим Утулик становится популярным у туристов, и для защиты нетронутой природной среды от чрезмерного негативного нерегулируемого антропогенного влияния было запланировано создание природного парка «Утулик-Бабха» в качестве ООПТ регионального уровня в качестве ООПТ регионального уровня общей площадью семь целых две десятых га."
