q,a
"После первой осечки на 5,80 м он пошёл ва-банк и перенёс оставшиеся попытки на 5,85 м, взял эту высоту с первого же раза и выиграл серебряную медаль соревнований, уступив лишь мировому рекордсмену из Франции Рено Лавиллени (6,04 м).","После первой осечки на пять целых восемьдесят сотых м он пошёл ва-банк и перенёс оставшиеся попытки на пять целых восемьдесят сотых м, взял эту высоту с первого же раза и выиграл серебряную медаль соревнований, уступив лишь мировому рекордсмену из Франции Рено Лавиллени (шесть целых четыре сотых м)."
"Это примерно соответствует скорости потери леса 2,7 % в течение трёх поколений (14,7 лет) для этого вида.",Это примерно соответствует скорости потери леса две целых семь десятых % в течение трёх поколений (тринадцать целых семь десятых лет) для этого вида.
"Силовики заинтересовались сыном Николая Патрушева из за коррупции в ""Россельхозбанке"" по делу сотрудников ""Россельхозбака"" (РСХБ), которые через подставные фирмы вывели до 1,5 млрд рублей..","Силовики заинтересовались сыном Николая Патрушева из за коррупции в ""Россельхозбанке"" по делу сотрудников ""Россельхозбака"" (РСХБ), которые через подставные фирмы вывели до одного с половиной млрд рублей."
"Занимает площадь 119,03 км².",Занимает площадь сто девятнадцать целых три сотых км2.
"Среднегодовая температура — 3,6 °C. Средняя температура воздуха самого тёплого месяца (июля) — 18,4 °C (абсолютный максимум — 37 °C); самого холодного (января) — −11,8 °C (абсолютный минимум — −40 °C).",Среднегодовая температура — три целых шесть десятых C. Средняя температура воздуха самого тёплого месяца (июля) — восемнадцать целых четыре десятых C (абсолютный максимум — тридцать семь C); самого холодного (января) — минус одиннадцать целых восемь десятых C (абсолютный минимум — 40 C).
"Среди русских русский родным языком назвали 97,2 %.",Среди русских русский родным языком назвали девяносто семь целых две десятых %.
"Среди молдаван 2,5 % назвали родным русский и 0,3 % другие языки.",Среди молдаван две с половиной % назвали родным русский и ноль целых три десятых % другие языки.
"31,8 % украинцев Молдовы родным назвали русский.",тридцать одна целая восемь десятых % украинцев Молдовы родным назвали русский.
"5,8 % гагаузов назвали родным русский язык.",пять целых восемь десятых % гагаузов назвали родным русский язык.
"13,9 % болгар республики также назвали родным русский.",тринадцать целых девять десятых % болгар республики также назвали родным русский.
"Из общего числа жителей страны 75,2 % обычно разговаривают на молдавском языке (или румынском), 16,0 % — на русском, 3,8 % — на украинском, 3,1 % — на гагаузском и 1,1 % — на болгарском.","Из общего числа жителей страны семьдесят пять целых две десятых % обычно разговаривают на молдавском языке (или румынском), шестнадцать целых ноль десятых % — на русском, три целых восемь десятых % — на украинском, три целых восемь десятых % — на гагаузском и одна целая одна десятая % — на болгарском."
"На всех прочих языках обычно разговаривают 0,4 % всего населения.",На всех прочих языках обычно разговаривают ноль целых четыре десятых % всего населения.
"Молдаване, которые обычно разговаривают на русском языке, составляют 5,0 % от общего их числа, в основном это городские жители гг.","Молдаване, которые обычно разговаривают на русском языке, составляют пять целых ноль десятых % от общего их числа, в основном это городские жители гг."
"Примечателен и тот факт, что и среди национальных меньшинств 6,2 % украинцев, 4,4 % русских, 1,9 % гагаузов, 2,2 % румын и 7,1 % болгар разговаривают в свою очередь чаще всего на молдавском языке.","Примечателен и тот факт, что и среди национальных меньшинств шесть целых две десятых % украинцев, четыре целых четыре десятых % русских, четыре целых четыре десятых % гагаузов, две целых две десятых % румын и семь целых одна десятая % болгар разговаривают в свою очередь чаще всего на молдавском языке."
"Таким образом доля русских, чаще всего использующих молдавский (4,4 %), практически равна доле молдаван чаще всего использующих русский (5,0 %).","Таким образом доля русских, чаще всего использующих молдавский (четыре целых четыре десятых %), практически равна доле молдаван чаще всего использующих русский (пять целых ноль десятых %)."
"Среднегодовая температура — 1,5 °C. Абсолютный минимум температуры воздуха самого холодного месяца (января) составляет −45 °C; абсолютный максимум самого тёплого месяца (июля) — 37 °C. Годовое количество атмосферных осадков — 687 мм, из которых большая часть выпадает в тёплый период.","Среднегодовая температура — один с половиной C. Абсолютный минимум температуры воздуха самого холодного месяца (января) составляет минус сорок пять целых сорок пять сотых C; абсолютный максимум самого тёплого месяца (июля) — тридцать семь с половиной мм, из которых большая часть выпадает в тёплый период."
"Занимает площадь 127,25 км².",Занимает площадь сто пятьдесят семь целых двадцать пять сотых км2.
"К ним относятся «аштакшара» (IAST: aṣṭakṣara), называемая также «тиру-мантра» или восьмислоговая мантра, посвящённая Вишну-Нараяне; ади-мантра изначального воспевания Вишну; двадакшари-мантра, называемая также двенадцатислоговой мантрой; двая-мантра (dvaya), состоящая из двух строк и посвящённая Вишну и его супруге Лакшми (Шри-деви); а также чарама-шлока — cтих 18.66 «Бхагавадгиты», в котором Кришна предлагает Арджуне отбросить все дхармы и религии и предаться ему как Высшей реальности — найдя прибежище в Вишну, освободится от недостатков и избавится от тяготящей его печали.","К ним относятся «аштакшара» (IAST: aakara) называемая также «тиру-мантра» или восьмислоговая мантра, посвящённая Вишну-Нараяне; ади-мантра или восьмислоговая мантра, называемая также восьмислоговая мантра, посвящённая Вишну-Нараяне; ади-мантра или восемь слоговая мантра, посвящённая Вишну-Нараяне; ади-мантра, называемая также двенадцатислоговой мантрой; двадакшари-мантра (dvaya), состоящая из двух строк и избавится от тяготящей его печали."
В «Бхагавадгите» Вишну провозгласил: «среди всех месяцев я — маргаширша» (стих 10.35).,В «Бхагавадгите» Вишну провозгласил: «среди всех месяцев я — маргаширша» (стих десять целых тридцать пять сотых).
"В качестве единственной политической цели провозглашалась «лока-санграха» («сплочение мира») — идея, позаимствованная из «Бхагаватгиты» (стих 3.20).","В качестве единственной политической цели провозглашалась «лока-санграха» («сплочение мира») — идея, позаимствованная из «Бхагаватгиты» (стих три целых двадцать сотых)."
"Альбом был продан тиражом 4,6 миллиона копий по всему миру, что делает его одним из самых продаваемых альбомов Дэвида.","Альбом был продан тиражом четыре целых шесть десятых миллиона копий по всему миру, что делает его одним из самых продаваемых альбомов Дэвида."
"Колодец обнесён камнем, его размеры составляют 1,2 × 0,6 метра.","Колодец обнесён камнем, его размеры составляют одну целую две десятых  ноль целых шесть десятых метра."
"Военная кампания обошлась Израилю в $2,7 млрд.",Военная кампания обошлась Израилю в $две целых семь десятых млрд.
"1,8 тысячи домов полностью разрушены, ещё 16,8 тысячи повреждены.","одна целая восемь десятых тысячи домов полностью разрушены, ещё шестнадцать целых восемь десятых тысячи повреждены."
"Наоборот, правительство Катара поддерживает ХАМАС и даже перевёл на счета группировки более 1,8 млрд долларов.","Наоборот, правительство Катара поддерживает ХАМАС и даже перевёл на счета группировки более одна целая восемь десятых млрд долларов."
"В том числе русские — 96,5 %; поляки — 1,3 %; украинцы — 1,1 %.",В том числе русские — девяносто шесть с половиной %; поляки — одна целая три десятых %; украинцы — одна целая одна десятая %.
"Располагался в отрогах Салаирского кряжа, на левом берегу реки Таловка (приток реки Степной Аламбай) в месте впадения в нее реки Тягушонок, приблизительно в 1,5 км (по-прямой) к северо-востоку от станции Тягун.","Располагался в отрогах Салаирского кряжа, на левом берегу реки Таловка (приток реки Степной Аламбай) в месте впадения в нее реки Тягушонок, приблизительно в одном с половиной км (по-прямой) к северо-востоку от станции Тягун."
"Как Пшевка впадает в озеро Старское (в Хвойнинском районе) высота озера — 156,1 и вытекает из него под названием Левочка.",Как Пшевка впадает в озеро Старское (в Хвойнинском районе) высота озера — сто пятьдесят шесть целых одна десятая и вытекает из него под названием Левочка.
"Плотность населения — 483,33 чел/кв.км.",Плотность населения — четыреста восемьдесят три целых тридцать три сотых чел/кв.км.
"Расовый состав: 88,87 % белые, 0,45 % чёрные, 4,85 % коренные американцы, 0,47 % азиаты, 0,88 % другие расы и 4,38 % две и более рас.","Расовый состав: восемьдесят восемь целых восемьдесят семь сотых % белые, ноль целых сорок пять сотых % чёрные, ноль целых сорок пять сотых % чёрные, четыре целых восемьдесят пять сотых % коренные американцы, ноль целых сорок пять сотых % азиаты, ноль целых восемьдесят восемь сотых % другие расы и четыре целых тридцать восемь сотых % две и более рас."
"16,1 % были немцами, 13,4 % англичанами, 12,1 % ирландцами.","шестнадцать целых одна десятая % были немцами, тринадцать целых четыре десятых % англичанами, двенадцать целых одна десятая % ирландцами."
"Средний размер домохозяйства равен 2.29, средний размер семьи 2.80.Средний доход на домохозяйство составил $27,711, а средний доход на семью $34,343.","Средний размер домохозяйства равен две целых двадцать девять сотых, средний размер семьи две целых восемьдесят сотых.Средний доход на домохозяйство составил $тридцать семьсот двадцать одна тысячная, а средний доход на семью $тридцать четыре целых триста тридцать одна тысячная."
"Средний размер домохозяйства равен 2.29, средний размер семьи 2.80.Средний доход на домохозяйство составил $27,711, а средний доход на семью $34,343.","Средний размер домохозяйства равен две целых двадцать девять сотых, средний размер семьи две целых восемьдесят сотых.Средний доход на домохозяйство составил $тридцать семьсот двадцать одна тысячная, а средний доход на семью $тридцать четыре целых триста тридцать одна тысячная."
"Мужчины имеют средний доход в $31,131, женщины $24,271.","Мужчины имеют средний доход в $тридцать одна целая сто семьдесят одна сотая, женщины $двадцать четыре целых двадцать семь сотых."
"Доход на душу населения $16,868.",Доход на душу населения $ шестнадцать целых восемьсот семьдесят восемь тысячных.
"Занимает площадь 0,468 км².",Занимает площадь ноль целых четыреста шестьдесят восемь тысячных км2.
"Верховой откос плотин защищён от размывания волнами железобетонными плитами толщиной 0,5 м.",Верховой откос плотин защищён от размывания волнами железобетонными плитами толщиной ноль с половиной м.
"Гидроагрегаты выдают электроэнергию на напряжении 13,8 кВ на однофазные трансформаторы, расположенные на здании ГЭС со стороны нижнего бьефа.","Гидроагрегаты выдают электроэнергию на напряжении тринадцать целых восемь десятых кВ на однофазные трансформаторы, расположенные на здании ГЭС со стороны нижнего бьефа."
"В отличие от Жигулёвской ГЭС, где два двухниточных шлюза разделены промежуточным бьефом протяжённостью 3,8 км, а также от Горьковской ГЭС, где также имеются два двухниточных шлюза, только разделённые обширной акваторией среднего бьефа, здесь в каждой нити имеются верхняя и нижняя шлюзовые камеры, вплотную прилегающие друг к другу.","В отличие от Жигулёвской ГЭС, где два двухниточных шлюза разделены промежуточным бьефом протяжённостью три целых восемь десятых км, а также от Горьковской ГЭС, где также имеются два двухниточных шлюза, только разделённые обширной акваторией среднего бьефа, здесь в каждой нити имеются верхняя и нижняя шлюзовые камеры, вплотную прилегающие друг к другу."
"Полная и полезная ёмкость водохранилища составляет 31,45 и 8,25 км³ соответственно, что позволяет осуществлять суточное и недельное регулирование стока (ёмкость водохранилища достаточна для обеспечения работы ГЭС в режиме регулирования неравномерностей энергопотребления в энергосистеме в течение суток и недели).","Полная и полезная ёмкость водохранилища составляет тридцать одна целая сорок пять сотых и восемь целых двадцать пять сотых км3 соответственно, что позволяет осуществлять суточное и недельное регулирование стока (ёмкость водохранилища достаточна для обеспечения работы ГЭС в режиме регулирования неравномерностей энергопотребления в энергосистеме в течение суток и недели)."
"При строительстве Волжской ГЭС одной из земляных плотин было перекрыто естественное русло Ахтубы, для обеспечения подачи в неё воды был построен Волго-Ахтубинский канал длиной 6,6 км.","При строительстве Волжской ГЭС одной из земляных плотин было перекрыто естественное русло Ахтубы, для обеспечения подачи в неё воды был построен Волго-Ахтубинский канал длиной шесть целых шесть десятых км."
"После смерти И. В. Сталина было принято решение о резком сокращении использования труда заключённых на строительстве, была проведена широкомасштабная амнистия, коснувшаяся миллиона заключённых (из их общего числа в 2,5 млн).","После смерти И. В. Сталина было принято решение о резком сокращении использования труда заключённых на строительстве, была проведена широкомасштабная амнистия, коснувшаяся миллиона заключённых (из их общего числа в два с половиной млн)."
"В ходе строительства Волжской ГЭС было произведено 145,2 млн м³ земляных работ, уложено 3,9 млн м³ каменной наброски, дренажей и фильтров, 5,47 млн м³ бетона и железобетона, смонтировано 79,3 тыс. т металлоконструкций и механизмов.","В ходе строительства Волжской ГЭС было произведено сто сорок пять целых две десятых млн м3 земляных работ, уложено три целых девять десятых млн м3 каменной наброски, дренажей и фильтров, пять целых сорок семь сотых млн м3 бетона и железобетона, смонтировано семьдесят девять целых три десятых тыс. т металлоконструкций и механизмов."
"В результате замены оборудования на более эффективное, мощность Волжской ГЭС постепенно увеличивается и после окончания модернизации должна составить 2744,5 МВт.","В результате замены оборудования на более эффективное, мощность Волжской ГЭС постепенно увеличивается и после окончания модернизации должна составить семьсот сорок четыре с половиной МВт."
