q,a
"Среди тех, кто в основном говорили на навахо, 78,8 % опрошенных сказали, что они знают английский язык «очень хорошо», что является довольно высоким показателем, однако процент таковых среди американцев, говорящих на других индейских языках, выше (85,4 %).","Среди тех, кто в основном говорили на навахо, семьдесят восемь целых восемь десятых % опрошенных сказали, что они знают английский язык «очень хорошо», что является довольно высоким показателем, однако процент таковых среди американцев, говорящих на других индейских языках, выше (девяносто пять целых четыре десятых %)."
"Навахо был единственным индейским языком, выделенным в опросе; среди говорящих на индейских языках дома навахо выбрали 46,4 % опрошенных.","Навахо был единственным индейским языком, выделенным в опросе; среди говорящих на индейских языках дома навахо выбрали сорок шесть целых четыре десятых % опрошенных."
"Температура кипения 165,38 °C, температура плавления −23,14 °C. Удельная теплоёмкость 0,4 кал/г (°C), теплота испарения 96,66 ккал/моль, теплота полимеризации 8,4 ккал/моль, энтропия полимеризации −26 кал/моль.","Температура кипения сто шестьдесят пять целых тридцать восемь сотых C, температура плавления двадцать три целых четырнадцать сотых кал/г (C), теплота полимеризации восемь целых четыре десятых ккал/моль, энтропия полимеризации 26 кал/моль."
"Растворимость в воде 0,01 % по объёму.",Растворимость в воде ноль целых одна десятая % по объёму.
"На оборотной стороне вверху по окружности, высотой текста 2,5 мм, надпись «ТВЕРСКАЯ ОБЛАСТЬ», в центре рельефная карта Тверской области с границами районов, от карты во все стороны расходятся лучи.","На оборотной стороне вверху по окружности, высотой текста две с половиной мм, надпись «ТВЕРСКАЯ ОБЛАСТЬ», в центре рельефная карта Тверской области с границами районов, от карты во все стороны расходятся лучи."
После нескольких месяцев поиска он устроился в качестве мальчика на побегушках (office boy) в фармацевтическую компанию Tolman and King с заработком 2.50$ в неделю.,После нескольких месяцев поиска он устроился в качестве мальчика на побегушках (office boy) в фармацевтическую компанию Tolman and King с заработком две целых пятьдесят сотых$ в неделю.
"Поршневое гнездо ввинчивалось в цилиндр С1 и имело фланец толщиной 114,3 мм (4,5 дюйма) с диаметром таким же как у орудия.",Поршневое гнездо ввинчивалось в цилиндр С1 и имело фланец толщиной сто четырнадцать целых три десятых мм (четыре с половиной дюйма) с диаметром таким же как у орудия.
"Хомут для крепления в люльке располагался в 1130,3 мм (44,5 дюймах) от торца затвора.",Хомут для крепления в люльке располагался в одна тысяча двести двадцать целых три десятых мм (сорок четыре с половиной дюймах) от торца затвора.
"Внешний диаметр ствола составлял 1358,9 мм (53,3 дюйма) в районе зарядной каморы.",Внешний диаметр ствола составлял сто пятьдесят восемь целых девять десятых мм (сто пятьдесят три целых три десятых дюйма) в районе зарядной каморы.
"Минимальный диаметр дульной части 596,9 мм (23,5 дюйма), дульное утолщение было диаметром 673,1 мм (26,5 дюйма).","Минимальный диаметр дульной части пятьсот девяносто шесть целых девять десятых мм (двадцать три с половиной дюйма), дульное утолщение было диаметром шестьсот семьдесят три целых одна десятая мм (шестьдесят шесть с половиной дюйма)."
"Если считать ток базы транзистора Q16 равным нулю, а напряжение база-эмиттер равным 0,625 В (типичное напряжение база-эмиттер для кремниевых биполярных транзисторов), то токи, текущие через резисторы 4,5 кОм и 7,5 кОм, будут одинаковы, а напряжение на резисторе 4,5 кОм составит 0,375 В. Таким образом, напряжение на всём двухполюснике будет равно 0,625 + 0,375 = 1 В. Это напряжение поддерживает выходные транзисторы в чуть открытом состоянии, что уменьшает искажения типа «ступенька».","Если считать ток базы транзистора 16 равным нулю, а напряжение база-эмиттер равным ноль целых шестьсот двадцать пять тысячных В (типичное напряжение база-эмиттер для кремниевых биполярных транзисторов), то токи, текущие через резисторы четыре с половиной кОм и семь с половиной кОм, будут одинаковы, а напряжение на резисторе четыре с половиной кОм составит ноль целых триста двадцать пять тысячных В."
"Занимает площадь 5776,261 км².",Занимает площадь семьсот семьдесят шесть целых двести девяносто одна тысячная км2.
"Плотность населения — 1,5 чел./км².",Плотность населения — один с половиной чел./км2.
"    {\displaystyle (A,B,C)\in {\mathcal {f}}0,1{\mathcal {g}}^{l_{a}}\times {\mathcal {f}}0,1{\mathcal {g}}^{l_{b}}\times {\mathcal {f}}0,1{\mathcal {g}}^{l_{c}}}","\displaystyle (A,B,C)\in \mathcal f0,1\mathcal gl_b\times \mathcal gl_b\times \mathcal gl_b\times \mathcal gl_c"
"    {\displaystyle (p,r)=(3,12)}","\displaystyle (p,r)=(три целых двенадцать сотых)"
"    {\displaystyle l_{h}\in {\mathcal {f}}192,224,256,384,512{\mathcal {g}}}","\displaystyle l_h\in \mathcal сто девяносто две целых двести двадцать четыре тысячных, двести восемьдесят четыре целых пятьсот пятьдесят четыре тысячных\mathcal g"
"Первое, это решение Верховного суда РФ по делу экс-управляющего дочерним предприятием НК ЮКОС «Самаранефтегазом» Павла Анисимова, осужденного на 2,5 года условно за неуплату компанией налогов, второе — решение в отношении управляющего ОАО «Юганскнефтегаз» Тагирзяна Гильманова, получившего три года условно за пособничество в уклонении от уплаты налогов организацией, третье — решение по иску Федеральной налоговой службы к аудитору ЮКОСа — ЗАО «ПрайсвотерхаусКуперс Аудит».","Первое, это решение Верховного суда РФ по делу экс-управляющего дочерним предприятием НК ЮКОС «Самаранефтегазом» Павла Анисимова, осужденного на две с половиной года условно за неуплату компанией налогов, второе — решение в отношении управляющего ОАО «Юганскнефтегаз» Тагирзяна Гильманова, получившего три года условно за пособничество в уклонении налогов организацией, третье — решение по иску Федеральной налоговой службы к аудитору ЮКОСа — ЗАО «Прайсвотерхаус Аудит»."
4.2 Idle unit switching activity: clock gating // Architectural Techniques for Low Power.,четыре целых две десятых Idle unit switching activity: clock gating // Architectural Techniques for Low Power.
"Согласно расследованию Важных историй, дочь Комарова Мария владеет квартирой в одном из самых дорогих районов Лондона — Белгрейвии — стоимостью около 4,2 млн фунтов стерлингов.","Согласно расследованию Важных историй, дочь Комарова Мария владеет квартирой в одном из самых дорогих районов Лондона — Белгрейвии — стоимостью около четырех целых двух десятых млн фунтов стерлингов."
"Недалеко от этой квартиры расположены апартаменты стоимостью 8,3 млн фунтов стерлингов, принадлежащие оффшорной компании Wastom Holdings с Британских Виргинских островов, которую основал сам Игорь Комаров.","Недалеко от этой квартиры расположены апартаменты стоимостью восемь целых три десятых млн фунтов стерлингов, принадлежащие оффшорной компании Wastom Holdings с Британских Виргинских островов, которую основал сам Игорь Комаров."
"2.5 Dimensional Seduction (яп. 2.5次元の誘惑(リリサ) Нитэнго-дзигэн но ририса, «Соблазн 2,5-мерного измерения») — манга, написанная и проиллюстрированная Ю Хасимото.","Dimensional Seduction (яп. две с половиной() Нитэнго-дзигэн но ририса, «Соблазн две с половиной-мерного измерения») — манга, написанная и проиллюстрированная Ю Хасимото."
Официальный сайт аниме (яп.)Аниме «2.5 Dimensional Seduction» (англ.) в энциклопедии сайта Anime News Network,Официальный сайт аниме (яп.)Аниме «две с половиной Dimensional Seduction» (англ.) в энциклопедии сайта Anime News Network
Аниме «2.5 Dimensional Seduction» (англ.) в базе данных AniDB,Аниме «две с половиной Dimensional Seduction» (англ.) в базе данных AniDB
"Среднегодовая температура воздуха — 4,6 °С. Средняя многолетняя температура самого холодного месяца (января) составляет −7,8 °С, средняя температура самого тёплого (июля) — +17,4°С. Продолжительность безморозного периода составляет около 135 дней.","Среднегодовая температура воздуха — четыре целых шесть десятых С. Средняя многолетняя температура воздуха — четыре целых шесть десятых С. Средняя многолетняя температура самого холодного месяца (января) составляет минус семь целых восемь десятых С, средняя температура самого тёплого (июля) — плюс семнадцать целых четыре десятыхС. Продолжительность безморозного периода составляет около сто тридцать пять целых сто пятьдесят пять тысячных дней."
"Ближайшие населённые пункты — Фроловское на противоположном берегу реки и Мисирёво в 0,5 км к западу.",Ближайшие населённые пункты — Фроловское на противоположном берегу реки и Мисирёво в ноль с половиной км к западу.
"На скальных выступах были обнаружены древние петроглифы (около 1,5 тысяч изображений) и древнетюркские надписи.",На скальных выступах были обнаружены древние петроглифы (около одного с половиной тысяч изображений) и древнетюркские надписи.
"Уровень грамотности населения составлял 70,6 %.",Уровень грамотности населения составлял семьдесят целых шесть десятых %.
"Уровень грамотности среди мужчин составлял 72,5 %, среди женщин — 68,2 %.","Уровень грамотности среди мужчин составлял семьдесят две с половиной %, среди женщин — шестьдесят восемь целых две десятых %."
"Соседние сёла: Краснознаменка в 0,8 км на восток, Рогово в 3,5 км на север и Трактовое в 4,7 км на запад.","Соседние сёла: Краснознаменка в ноль целых восемь десятых км на восток, Рогово в три с половиной км на север и Трактовое в четыре целых семь десятых км на запад."
"31,4 млрд рублей.",тридцать одна целая четыре десятых млрд рублей.
"На сегодняшний день на территории региона действуют семь племенных хозяйств с общим подголовьем племенных животных — 135,3 тыс. голов.",На сегодняшний день на территории региона действуют семь племенных хозяйств с общим подголовьем племенных животных — сто пятьдесят пять целых три десятых тыс. голов.
"В структуре поголовья скота на сельскохозяйственные организации приходилось 11,5 % поголовья крупного рогатого скота, 19,6 % — овец и коз; на хозяйства населения — 50,1 %, 7,9 %; на крестьянские (фермерские) хозяйства — 38,4 %, 72,5 %, соответственно.","В структуре поголовья скота на сельскохозяйственные организации приходилось одиннадцать с половиной % поголовья крупного рогатого скота, девятнадцать целых шесть десятых % — овец и коз; на хозяйства населения — пятьдесят целых одна десятая %, семь целых девять десятых %; на крестьянские (фермерские) хозяйства — тридцать восемь целых четыре десятых %, семьдесят восемь целых четыре десятых %, семьдесят восемь целых четыре десятых %, семьдесят восемь с половиной %, семьдесят восемь с половиной %, семьдесят восемь с половиной %, соответственно."
"В том числе урожай тепличных огурцов составляет 271,0 тыс. тонн (+28,2 %), томатов — 142,7 тыс. тонн (+72,3 %).","В том числе урожай тепличных огурцов составляет двести семьдесят одна целая ноль десятых тыс. тонн (плюс двадцать восемь целых две десятых %), томатов — сто шестьдесят две целых семь десятых тыс. тонн (плюс семьдесят две целых три десятых тыс. тонн (плюс семьдесят две целых три десятых %)."
"В структуре производства зерна увеличился удельный вес ячменя и пшеницы (с 5,0 % до 5,3 %, с 13,8 % до 20,8 %, соответственно).","В структуре производства зерна увеличился удельный вес ячменя и пшеницы (с пять целых ноль десятых % до пяти целых трех десятых %, с тринадцатью целыми восемь десятых % до двадцати целых восьми десятых %, соответственно)."
"                2,541",две целых пятьсот сорок одна сотая.
"                2,541",две целых пятьсот сорок одна сотая.
"81,7 % от общего количества кораблей различного типа.Также при разделе Черноморского флота под российской юрисдикцией осталась большая часть состава 184-й бригады кораблей охраны водного района, дислоцировавшейся в Грузии в г. Поти.",семьдесят одна целая семь десятых % от общего количества кораблей различного типа.Также при разделе Черноморского флота под российской юрисдикцией осталась большая часть состава сто девяносто четыре целых семь десятых % от общего количества кораблей различного типа.Также при разделе Черноморского флота под российской юрисдикцией осталась большая часть состава сто девяносто четыре целых семь десятых % от общего количества кораблей различного типа.Также при разделе Черноморского флота под российской юрисдикцией осталась большая часть состава сто девяносто четыре целых семь десятых % от общего количества кораблей различного типа.
"Напряжение литий-ионных аккумуляторов кратно 3,6 вольт, а никель-кадмиевых и никель-металл-гидридных — 1,2 вольт, так как аккумуляторный блок состоит из отдельных, последовательно соединённых элементов с соответствующим напряжением.Наличие в комплекте второго аккумулятора позволяет не прерывать работу на ожидание зарядки одного аккумулятора: пока разряжается один — заряжается другой.","Напряжение литий-ионных аккумуляторов кратно три целых шесть десятых вольт, а никель-кадмиевых и никель-металл-гидридных — одна целая две десятых вольт, так как аккумуляторный блок состоит из отдельных, последовательно соединённых элементов с соответствующим напряжением."
"Напряжение литий-ионных аккумуляторов кратно 3,6 вольт, а никель-кадмиевых и никель-металл-гидридных — 1,2 вольт, так как аккумуляторный блок состоит из отдельных, последовательно соединённых элементов с соответствующим напряжением.Наличие в комплекте второго аккумулятора позволяет не прерывать работу на ожидание зарядки одного аккумулятора: пока разряжается один — заряжается другой.","Напряжение литий-ионных аккумуляторов кратно три целых шесть десятых вольт, а никель-кадмиевых и никель-металл-гидридных — одна целая две десятых вольт, так как аккумуляторный блок состоит из отдельных, последовательно соединённых элементов с соответствующим напряжением."
"Тест аккумуляторных дрелей-шуруповёртов с напряжением аккумулятора 14,4 вольт.",Тест аккумуляторных дрелей-шуруповёртов с напряжением аккумулятора четырнадцать целых четыре десятых вольт.
"Занимает площадь 562,395 км².",Занимает площадь пятьсот шестьдесят две целых триста девяносто пять тысячных км2.
"Плотность населения — 13,5 чел./км².",Плотность населения — тринадцать с половиной чел./км2.
"Примеры трёхцилиндровых паровозов: советский серии М, немецкий «BR 01.10» и чехословацкий «Друг».У четырёхцилиндровых паровозов (паровая машина в этом случае в основном типа компаунд) два цилиндра располагаются снаружи рамы, а остальные два могут располагаться либо между половинами рамы (серии Л, У, Фл), либо снаружи, причём в этом случае 2 цилиндра с каждой стороны, в свою очередь, могут располагаться либо друг за другом (тандем-компаунд, пример — серии Р), либо друг над другом (системы Воклена, пример — паровозы В и Дк американского производства).","Примеры трёхцилиндровых паровозов: советский серии М, немецкий «BR ноль целых десять сотых» и чехословацкий «Друг»."
