q,a
"Основные характеристики: полная длина составляла от шести до восьми метров, ширина — около двух метров, высота борта 0,9 метра, осадка — полметра, грузоподъёмность — около трёх тонн.","Основные характеристики: полная длина составляла от шести до восьми метров, ширина — около двух с половиной метра, высота борта ноль целых девять десятых метра, осадка — полметра, грузоподъёмность — около трёх с половиной тонн."
"Длина 4,5 мм, ширина 2,1 мм.","Длина четыре с половиной мм, ширина две целых одна десятая мм."
"Пронотум в 1,3 раз шире своей длины и в передней трети с почти параллельными боками.",Пронотум в одну целую три десятых раз шире своей длины и в передней трети с почти параллельными боками.
"Скутеллюм в 1,2 раз длиннее своей ширины, слегка выпуклый, грубо пунктированный.","Скутеллюм в одну целую две десятых раз длиннее своей ширины, слегка выпуклый, грубо пунктированный."
"Надкрылья в 2,5 раз длиннее переднеспинки и в 1,75 длиннее своей ширины.",Надкрылья в две с половиной раз длиннее переднеспинки и в одну целую семьдесят пять сотых длиннее своей ширины.
"Расчетный пролет составляет 16,8 м.",Расчетный пролет составляет шестнадцать целых восемь десятых м.
"Масса — около 0,597 солнечной, радиус — около 0,581 солнечного, светимость — около 0,069 солнечной.","Масса — около ноля пятьсот девяносто семь тысячных солнечной, радиус — около ноля пятьсот восемьдесят одна тысячная солнечного, светимость — около ноля целых шестьдесят девять сотых солнечной."
"Среднегодовая температура воздуха — 4,1 °C. Средняя температура воздуха самого холодного месяца (января) — −10 — −8,5 °C (абсолютный минимум — −48 °C), средняя температура самого тёплого (июля) — 17 °С (абсолютный максимум — 37 °С).","Среднегодовая температура воздуха — четыре целых одна десятая C. Средняя температура воздуха самого холодного месяца (января) — минус десять — восемь с половиной C (абсолютный минимум — 48 С), средняя температура самого тёплого (июля) — семнадцать с половиной С (абсолютный максимум — тридцать семь с половиной С)."
"Расстояние по автодороге до районного центра Вытегры — 33,5 км, до центра муниципального образования села Андомский Погост — 1,5 км.","Расстояние по автодороге до районного центра Вытегры — тридцать три с половиной км, до центра муниципального образования села Андомский Погост — один с половиной км."
"Занимает площадь 1,046 км².",Занимает площадь одна целая четыреста пятьдесят шесть тысячных км2.
"Годовая убыль населения — 0,5 % (высокий уровень эмиграции из страны).",Годовая убыль населения — ноль с половиной % (высокий уровень эмиграции из страны).
"43,5 % — индийцы;",сорок три с половиной % — индийцы;
"30,2 % — афро-гайанцы;",тридцать целых две десятых % — афро-гайанцы;
"16,7 % — смешанного происхождения (метисы и мулаты);",шестнадцать целых семь десятых % — смешанного происхождения (метисы и мулаты);
"9,1 % — индейцы;",девять целых одна десятая % — индейцы;
"0,4 % — другие (португальцы, китайцы, арабы).Языки:","четыре целых четыре десятых % — другие (португальцы, китайцы, арабы).Языки:"
"0,4 % — другие (португальцы, китайцы, арабы).Языки:","четыре целых четыре десятых % — другие (португальцы, китайцы, арабы).Языки:"
"Христианство — 57,4 %:",Христианство — пятьдесят семь целых четыре десятых %:
"пятидесятники — 16,9 % (Ассамблеи Бога и др.);",пятидесятники — шестнадцать целых девять десятых % (Ассамблеи Бога и др.);
"католики — 8,1 %;",католики — восемь целых одна десятая %;
"англикане — 6,9 %;",англикане — шесть целых девять десятых %;
"методисты — 1,7 %;",методисты — одна целая семь десятых %;
"свидетели Иеговы — 1,1 %;",свидетели Иеговы — одна целая одна десятая %;
"другие христиане — 17,7 %;",другие христиане — семнадцать целых семь десятых %;
"Индуизм — 28,4 %;",Индуизм — двадцать восемь целых четыре десятых %;
"Ислам — 7,2 %;",Ислам — семь целых две десятых %;
"атеисты — 4,3 %;",атеисты — четыре целых три десятых %;
"прочие — 2,7 %.",прочие — две целых семь десятых %.
"Таким образом было подготовлено к эвакуации только 7,5 тысячи живописных работ.",Таким образом было подготовлено к эвакуации только семи с половиной тысячи живописных работ.
"Среднегодовая температура воздуха — +3,5 °C. Средняя температура воздуха самого холодного месяца (января) — −11,1 °C (абсолютный минимум — −46 °C); самого тёплого месяца (июля) — +18,2 °C (абсолютный максимум — +38 °C).",Среднегодовая температура воздуха — плюс три с половиной C. Средняя температура воздуха — плюс три с половиной C. Средняя температура воздуха самого холодного месяца (января) — минус одиннадцать с половиной C (абсолютный минимум — минус сорок шесть с половиной C); самого тёплого месяца (июля) — плюс восемнадцать целых две десятых C (абсолютный максимум — плюс восемнадцать целых две десятых C (абсолютный максимум — плюс тридцать восемь с половиной C).
"Среднегодовая скорость ветра — 4,7 м/с.",Среднегодовая скорость ветра — четыре целых семь десятых м/с.
"Активы фонда оцениваются в 1,5 млрд долларов.",Активы фонда оцениваются в один с половиной млрд долларов.
"Длина от 1,6 до 2,1 мм, переднее крыло до 2,3 мм.","Длина от одной целой шести десятых до двух целых одой десятой мм, переднее крыло до двух целых трех десятых мм."
"Среднегодовая температура — 4,9 °C. Средняя температура воздуха самого тёплого месяца (июля) — 16 — 20 °C (абсолютный максимум — 40 °C); самого холодного (января) — −12 — −5 °C (абсолютный минимум — −37 °C).",Среднегодовая температура — четыре целых девять десятых C. Средняя температура воздуха самого тёплого месяца (июля) — шестнадцать целых двадцать сотых C (абсолютный максимум — сорок с половиной C); самого холодного (января) — минус двенадцать с половиной — 5 C (абсолютный минимум — 37 C).
"Административный центр — деревня Слохтерен (с населением около 2,5 тыс.жителей).",Административный центр — деревня Слохтерен (с населением около двух с половиной тыс.жителей).
"Жемчужный астрильд достигает длины до 12,5 см. У самца верхушка головы, спина и крылья красновато-бурые.","Жемчужный астрильд достигает длины до двенадцати с половиной см. У самца верхушка головы, спина и крылья красновато-бурые."
"Жемчужный астрильд достигает длины до 12,5 см. У самца верхушка головы, спина и крылья красновато-бурые.","Жемчужный астрильд достигает длины до двенадцати с половиной см. У самца верхушка головы, спина и крылья красновато-бурые."
"Занимает площадь 3,144 км².",Занимает площадь три целых сто сорок четыре тысячных км2.
"Среднегодовая температура воздуха — 4,5 °C. Средняя многолетняя температура самого холодного месяца (января) составляет −9°С (абсолютный минимум — −50 °C), средняя температура самого тёплого (июля) — 17 °С (абсолютный максимум — 36 °С).","Среднегодовая температура воздуха — четыре с половиной C. Средняя многолетняя температура воздуха — четыре с половиной C (абсолютный минимум — 50 C), средняя температура самого тёплого (июля) — семнадцать С (абсолютный максимум — тридцать шесть с половиной С)."
В некоторых версиях игры противник может сдаться (эта возможность была возвращена в версии 1.02).,В некоторых версиях игры противник может сдаться (эта возможность была возвращена в версии одна целая две сотых).
В патче 1.01 была добавлена возможность продолжить игру после потопления «Черной Жемчужины».,В патче одна целая одна сотая была добавлена возможность продолжить игру после потопления «Черной Жемчужины».
"Патч 1.02 возвращает в игру некоторые возможности: сдачу в плен вражеского капитана и команды, потерю мачт в морском бою.","Патч одна целая две сотых возвращает в игру некоторые возможности: сдачу в плен вражеского капитана и команды, потерю мачт в морском бою."
В патче 1.03 корабли управляемые АИ теперь более точно анализируют ситуацию.,В патче одна целая три сотых корабли управляемые АИ теперь более точно анализируют ситуацию.
"Среднегодовая температура — 2,7 °C. Средняя температура воздуха самого тёплого месяца (июля) — 17,9 °C (абсолютный максимум — 37 °C); самого холодного (января) — −12,3 °C (абсолютный минимум — −46 °C).",Среднегодовая температура — две целых семь десятых C. Средняя температура воздуха самого тёплого месяца (июля) — семнадцать целых девять десятых C (абсолютный максимум — тридцать семь целых две десятых C); самого холодного (января) — минус двенадцать целых три десятых C (абсолютный минимум — сорок шесть C (абсолютный минимум — сорок шесть C).
"В расовом отношении белые и метисы составляли 99,9 % от населения города; негры, мулаты и райсальцы — 0,1 %.","В расовом отношении белые и метисы составляли девяносто девять целых девять десятых % от населения города; негры, мулаты и райсальцы — ноль целых одна десятая %."
"Уровень грамотности среди всего населения составлял 87,2 %.",Уровень грамотности среди всего населения составлял восемьдесят семь целых две десятых %.
"56,6 % от общего числа городских и муниципальных предприятий составляют предприятия торговой сферы, 32,5 % — предприятия сферы обслуживания, 8,4 % — промышленные предприятия, 2,5 % — предприятия иных отраслей экономики.","пятьдесят шесть целых шесть десятых % от общего числа городских и муниципальных предприятий составляют предприятия торговой сферы, тридцать два с половиной % — предприятия сферы обслуживания, восемь целых четыре десятых % — промышленные предприятия, две с половиной % — предприятия иных отраслей экономики."
"Занимает площадь 771,77 км².",Занимает площадь семьсот семьдесят одна целая семьдесят семь сотых км2.
"Её длина составляет 27,1 км, из которых 25,4 км проложены по эстакадам.","Её длина составляет двадцать семь целых одна десятая км, из которых двадцать пять целых четыре десятых км проложены по эстакадам."
"Занимает площадь 101,6 км².",Занимает площадь сто одна целая шесть десятых км2.
"В «Стране Игр» была принята десятибалльная система оценок с шагом в 0,5 балла.",В «Стране Игр» была принята десятибалльная система оценок с шагом в ноль с половиной балла.
https://web.archive.org/web/20110720112751/http://training.ce.washington.edu/WSDOT/Modules/07_construction/07-2_body.htm глава 2.2.3.2 Milling,https://web.archive.org/web/20110720112751/http://training.ce.washington.edu/WSDOT/Modules/07_construction/07-2_body.htm глава две целых две десятых Milling
"Среднегодовая температура воздуха — 2,5 °С. Средняя температура воздуха самого тёплого месяца (июля) — 18,7 °C; самого холодного (января) — −14,2 °C. Среднегодовое количество атмосферных осадков составляет 400—450 мм, из которых до 300 мм выпадает в тёплый период.","Среднегодовая температура воздуха — две с половиной С. Средняя температура воздуха самого тёплого месяца (июля) — восемнадцать целых семь десятых C; самого холодного (января) — минус четырнадцать целых две десятых C. Среднегодовое количество атмосферных осадков составляет четыреста пятьдесят целых четыреста пятьдесят тысячных мм, из которых до 300 мм выпадает в тёплый период."
"Среднегодовая температура воздуха — 2,5 °С. Средняя температура воздуха самого тёплого месяца (июля) — 18,7 °C; самого холодного (января) — −14,2 °C. Среднегодовое количество атмосферных осадков составляет 400—450 мм, из которых до 300 мм выпадает в тёплый период.","Среднегодовая температура воздуха — две с половиной С. Средняя температура воздуха самого тёплого месяца (июля) — восемнадцать целых семь десятых C; самого холодного (января) — минус четырнадцать целых две десятых C. Среднегодовое количество атмосферных осадков составляет четыреста пятьдесят целых четыреста пятьдесят тысячных мм, из которых до 300 мм выпадает в тёплый период."
"Наиболее раннее погребение Homo Sapiens, обнаруженное археологами в Африке, датируется 78,3±4,1 тысяч лет назад.","Наиболее раннее погребение Homo Sapiens, обнаруженное археологами в Африке, датируется семьдесят восемь целых три десятых4 тысяч лет назад."
"Занимает площадь 95,02 км².",Занимает площадь девяносто пять целых две сотых км2.
"Непосредственно на нижней панели находится mini-USB порт, слот для карты памяти стандарта microSD, разъемы для подключения зарядного устройства и наушников (3,5 мм).","Непосредственно на нижней панели находится mini-USB порт, слот для карты памяти стандарта microSD, разъемы для подключения зарядного устройства и наушников (трех с половиной мм)."
"Из измерений параллакса, полученных во время миссии Hipparcos, известно, что звезда удалена на приблизительное расстояние в 57,3 св.г.","Из измерений параллакса, полученных во время миссии Hipparcos, известно, что звезда удалена на приблизительное расстояние в пятьдесят семь целых три десятых св.г."
"HD 165185 является аналогом Солнца, ещё не вышедшим на главную последовательность, имеющую спектральный класс G1 V. Она быстро вращается: её скорость вращения — 7,53 км/с, а период вращения — 5,9 дня.","HD одна тысяча двести восемьдесят пять целых восемьдесят пять тысячных является аналогом Солнца, ещё не вышедшим на главную последовательность, имеющую спектральный класс G1 V. Она быстро вращается: её скорость вращения — семь целых пятьдесят три сотых км/с, а период вращения — пять целых девять десятых дня."
"HD 165185 является аналогом Солнца, ещё не вышедшим на главную последовательность, имеющую спектральный класс G1 V. Она быстро вращается: её скорость вращения — 7,53 км/с, а период вращения — 5,9 дня.","HD одна тысяча двести восемьдесят пять целых восемьдесят пять тысячных является аналогом Солнца, ещё не вышедшим на главную последовательность, имеющую спектральный класс G1 V. Она быстро вращается: её скорость вращения — семь целых пятьдесят три сотых км/с, а период вращения — пять целых девять десятых дня."
"Длина самой маленькой самки этого вида составила 7,9 мм, а самого крупного известного представителя — 10,3 мм.","Длина самой маленькой самки этого вида составила семь целых девять десятых мм, а самого крупного известного представителя — десять целых три десятых мм."
"Является самым длинным городом Европы — линейное расстояние от крайней северной точки до южной по прямой составляет 66,1 км.",Является самым длинным городом Европы — линейное расстояние от крайней северной точки до южной по прямой составляет шестьдесят шесть целых одна десятая км.
"Они обеспечены питательными веществами, содержат 4,5—4,9 % гумуса и распространены на водоразделах.","Они обеспечены питательными веществами, содержат четыре с половиной—четыре целых девять десятых % гумуса и распространены на водоразделах."
"Лугово-чернозёмные почвы характеризуются высокими показателями содержания гумуса (5,9 %) и распространены на пойменных террасах рек.",Лугово-чернозёмные почвы характеризуются высокими показателями содержания гумуса (пять целых девять десятых %) и распространены на пойменных террасах рек.
"Из восьми кандидатов он занял второе место с 20,1 % голосов.",Из восьми кандидатов он занял второе место с двадцатью целыми одной десятой % голосов.
